,index,id,created_at,text,year,month,day
199,9,1333780124173557761,2020-12-01T14:28:56.000Z,RT @baijushah: Excited to announce our research on the #BusinessOfExperience. We are in a Renaissance as all of our Experiences are being r…,2020,12,1
200,10,1331573466005450753,2020-11-25T12:20:28.000Z,"RT @APRippert: Excited to announce that End-to-End Analytics will be joining the @Accenture family, helping companies gain more business va…",2020,11,25
201,11,1331304285422972928,2020-11-24T18:30:50.000Z,I’m pleased to see @Accenture named the category leader in Digital Business Transformation Services by @Forrester. It’s recognition of our people’s commitment to helping our clients accelerate transformation &amp; create 360 degree value across the enterprise. https://t.co/GH6yJTuERP,2020,11,24
202,12,1331296288277721088,2020-11-24T17:59:04.000Z,"RT @JMOllagnier: I'm excited to announce our partnership with @IP__Paris to establish the Chair of Technology for Change, which aims to acc…",2020,11,24
203,13,1330940589991473155,2020-11-23T18:25:38.000Z,"Today I join leaders calling for the presidential transition to move forward without delay. The challenges we face are clear. Now is the time to unify to defeat the pandemic, close the digital divide, and rebuild the economy. https://t.co/j84jXpy8SR",2020,11,23
204,14,1330845340577181696,2020-11-23T12:07:09.000Z,RT @Accenture: What does it mean to be Black today? Our African and Caribbean employee network in the UK and Ireland partnered with Black f…,2020,11,23
205,15,1329888382244298753,2020-11-20T20:44:33.000Z,"RT @ManishSharma_70: We’re pleased to welcome @ArcaTelecom to Accenture! Together, our #SynOps platform and Arca’s #network operations capa…",2020,11,20
206,16,1329812293241237504,2020-11-20T15:42:12.000Z,RT @accenture_br: Temos um compromisso com a #inclusão e a #diversidade. Em um ano em que o mundo voltou sua atenção para as questões racia…,2020,11,20
207,17,1329478024702685184,2020-11-19T17:33:56.000Z,RT @AccentureChina: We’re thrilled to be named a leader in 2020 @IDC MarketScape Asia/Pacific @SAP Implementation Services Assessment. Lear…,2020,11,19
208,18,1329467584383770627,2020-11-19T16:52:27.000Z,"RT @CBUSRegion: We’re excited to announce that @JulieSweet, Chief Executive Officer of @Accenture, will be speaking at this year’s virtual…",2020,11,19
209,19,1329118478675095552,2020-11-18T17:45:13.000Z,"RT @nytimesevents: “When purpose leads the way, success and results follow.” - @Accenture North America CEO @JimmyEtheredge at the #DealBoo…",2020,11,18
210,20,1328833108356042755,2020-11-17T22:51:16.000Z,"@UpwardlyGlobal @Accenture @WesternUnionCEO @WesternUnion @octanner I was honored to join the @UpwardlyGlobal gala on behalf of our @Accenture people around the world. We have a collective and unwavering commitment to inclusion, diversity and equality for all, and we value our long partnership with UpGlo and the important work you do.",2020,11,17
211,21,1328746749251510273,2020-11-17T17:08:06.000Z,"Thank you for inviting me to share a message from @Accenture at the @unfoundation’s #GlobalDialogue. We're committed to bringing together technology and human ingenuity to solve some of the world’s biggest challenges, with the UNGC Sustainable Development Goals as our North Star. https://t.co/pUYAQragRN",2020,11,17
212,22,1328397880227483651,2020-11-16T18:01:49.000Z,RT @AccentureCanada: Pleased to welcome the Avenai team who will help public sector clients transform to meet the challenges of today and t…,2020,11,16
213,23,1327588844565389314,2020-11-14T12:27:00.000Z,"RT @JimmyEtheredge: Throughout November, I am sharing stories about how Accenture and our people are leading change and helping communities…",2020,11,14
214,24,1327298087602319360,2020-11-13T17:11:38.000Z,"RT @rekha_m_menon: May this Diwali light up your life with joy, prosperity and good health. https://t.co/vlm0FetGaN",2020,11,13
215,25,1327285015038849025,2020-11-13T16:19:42.000Z,RT @JeffreyRussell_: Thrilled to see @AccentureCanada recognized by @top_employers for 11 straight years. Congrats to our team and all of t…,2020,11,13
216,26,1327005087865167881,2020-11-12T21:47:22.000Z,"RT @UpwardlyGlobal: Tonight, Upwardly Global commemorates 20 years of building opportunity for immigrants and refugees. Join us as we celeb…",2020,11,12
217,27,1326889575365664768,2020-11-12T14:08:21.000Z,"RT @DetroitChamber: This Friday at 11 a.m., our #MPC20 Conversations series will conclude with a conversation on why CEOs must accelerate,…",2020,11,12
218,28,1326591458200203265,2020-11-11T18:23:45.000Z,"RT @ParisPeaceForum: Key actors of #globalgovernance, the #ParisPeaceForum2020 partners share their priorities for the world of tomorrow.🌎…",2020,11,11
219,29,1326536839474405376,2020-11-11T14:46:43.000Z,"On #VeteransDay, I join you in honoring the contributions &amp; sacrifices of the military community, veterans &amp; their families. Thank you to all @Accenture veterans for the invaluable leadership you bring to our clients &amp; communities. https://t.co/fJri8CmL9l",2020,11,11
220,30,1326536304608256007,2020-11-11T14:44:35.000Z,"RT @JeffreyRussell_: As we wear our poppies, we honour those who have given their lives for Canada and for peace.

I'm especially proud tod…",2020,11,11
221,31,1325939725576916992,2020-11-09T23:14:00.000Z,".@Lounibos, your team @Accenture Ventures and Project Spotlight are unleashing powerful innovation with tech startups like @_skyhive. It’s a great example of the opportunity for business to help advance economic empowerment &amp; inclusion through technology. https://t.co/Y4baWixuxr",2020,11,9
222,32,1325539026166812674,2020-11-08T20:41:45.000Z,"Congratulations to President-elect Biden and VP-elect Harris. Now more than ever I think of our nation’s motto – E Pluribus Unum – “out of many, one.” This is the time to come together to defeat the pandemic and rebuild the economy for the benefit of all. https://t.co/KxpffQgEWj",2020,11,8
223,0,1323395388930482177,2020-11-02T22:43:42.000Z,".@YouthInc_NYC transforms the lives of kids by empowering nonprofits. I’ll join them on Nov 5 for a virtual talk with David Rubenstein about topics like the role business can play in areas that concern all of us, like fighting racism. Do join us! https://t.co/Rn3DiwKnov https://t.co/fKaIHJ635J",2020,11,2
224,1,1323321205798166536,2020-11-02T17:48:56.000Z,RT @JMOllagnier: Very happy to confirm this and welcome @salt_solutions  to the @Accenture family. Excited to see how we can expand our #In…,2020,11,2
225,2,1323272267942535168,2020-11-02T14:34:28.000Z,"I’m happy to welcome the @Enimbos team to @Accenture. This is the time for every company to accelerate the move to the #cloud as a foundation for #digitaltransformation. Thank you for your leadership of our Accenture Cloud First strategy, @KarthikSNarain. https://t.co/IRZXmm7At6",2020,11,2
226,3,1322301801538965504,2020-10-30T22:18:11.000Z,".@Richkarlgaard thank you for the insightful questions! It was a pleasure to talk with you about so many important topics, including the accelerating pace of change, the challenges businesses are facing and @Accenture’s commitment to rebuilding for the benefit of all.  @Forbes https://t.co/ybboL5AyvV",2020,10,30
227,4,1322284016591081473,2020-10-30T21:07:31.000Z,"RT @DisabilityIN: Research shows employment growth for people with disabilities. Check out this video from @Accenture CEO, @JulieSweet, who…",2020,10,30
228,5,1321896154766991360,2020-10-29T19:26:17.000Z,"RT @AccentureUK: Our European CEO @JMOllagnier
 tells @bbcaaron how ""#digital on one side and #sustainability on the other side is changing…",2020,10,29
229,6,1321067868126171137,2020-10-27T12:34:58.000Z,"Thank you, @leetmoore01, and thanks to our @Accenture Midwest team for successfully adapting our summer analyst internship program to the new digital reality. And congratulations to all of our summer analysts. I’m so impressed by your flexibility and talent! https://t.co/CNSS0SeN1D",2020,10,27
230,7,1320702893025042433,2020-10-26T12:24:41.000Z,"Today, we officially launch the @MIT and @Accenture Convergence Initiative for Industry and Technology. The rapid progress the world needs depends on industries learning from each other, tech leaders and diverse perspectives across business and academia. https://t.co/BaXruXfGCb https://t.co/hOlHO4jPMt",2020,10,26
231,8,1320666201765351426,2020-10-26T09:58:53.000Z,Congratulations Wolters Kluwer CEO and @Accenture board member Nancy McKinstry! It is wonderful to see you’ve been honored on the @FortuneMagazine Most Powerful Women International list again. https://t.co/9Eqv7O30qT,2020,10,26
232,9,1320034481533833217,2020-10-24T16:08:40.000Z,".@SandaOjiambo, I join you in celebrating the mission of the @GlobalCompact and @UN #GlobalGoals on #UNDay. @Accenture’s commitment to #equality for all is unwavering. We will continue to take action to accelerate change. @PeterLacy https://t.co/C8hiL0EaPk",2020,10,24
233,10,1319937901510201344,2020-10-24T09:44:53.000Z,"Congratulations to the four women CEOs being honored by @Accenture and @SpringboardEnt for technological innovation in the retail and health industries. And thank you, @APRippert for leading our collaboration with Springboard. #womeninleadership https://t.co/agN4EBMSeT",2020,10,24
234,11,1319395613176451074,2020-10-22T21:50:02.000Z,".@TamiErwinVZ, I look forward to joining you for Friday’s #WomenInTech Panel with @suzywillow. We set bold goals to advance gender diversity at @Accenture and conversations around growing leadership roles for women in tech benefit all of us. https://t.co/6ShsEjSdv9",2020,10,22
235,12,1318334620417523714,2020-10-19T23:34:01.000Z,"Thank you for this thoughtful article, @martyswant. The new @Accenture brand draws inspiration from our people around the world and their commitment to delivering 360° value through change. https://t.co/L09EM3ofRe",2020,10,19
236,13,1318272404460916736,2020-10-19T19:26:48.000Z,"Thank you, @FortuneMagazine. It’s an honor to be named among this group of outstanding leaders. And thank you to our @Accenture people around the world, as this recognition reflects your commitment, ingenuity and outstanding work every day. https://t.co/l3ejgCfrlB",2020,10,19
237,14,1316344270698303488,2020-10-14T11:45:05.000Z,"Today, @Accenture unveils our new purpose and brand. In a uniquely challenging year, this is a time to look to the future and commit to being a force for positive change for our clients, people, shareholders, partners and communities. https://t.co/EAXhUhdN6p #LetThereBeChange https://t.co/eKLJXsNf1V",2020,10,14
238,15,1315950586987188225,2020-10-13T09:40:43.000Z,".@TheMyrtleGroup has deep expertise in all areas of manufacturing and supply chain, from sourcing to execution. @NigelStacey and @JRamsayDigital, I’m delighted to join you in welcoming the Myrtle team to our growing @Accenture #IndustryX family! https://t.co/RM1RGjnbl0",2020,10,13
239,16,1314594208729235458,2020-10-09T15:50:57.000Z,".@Accenture announced new commitments to sustainability and a new leadership role. With @PeterLacy as Chief Responsibility Officer &amp; Global Sustainability Services Lead, we’ll embed responsible business into all of our services and areas of the company. https://t.co/9pJW4CBtIP https://t.co/bj55eGbXP0",2020,10,9
240,0,1314213701214330882,2020-10-08T14:38:57.000Z,"@hansvestberg @cristianoamon @ChuckRobbins @e_cousens @GaryShapiro @ForestWhitaker Thanks, @hansvestberg, I took up tennis at age 52! My girls are much better than me. What are you doing to stay well, @CarolBTome?",2020,10,8
241,1,1311744730255052800,2020-10-01T19:08:09.000Z,"We believe these goals as well as new mandatory training and other actions will help make Accenture more inclusive, diverse and representative of the communities where our people are living and working.",2020,10,1
242,2,1311744396556197890,2020-10-01T19:06:49.000Z,Across @Accenture we continue to take actions against racism and inequality. Today we announced new goals to increase the representation of our African Black and Coloured colleagues in South Africa and our Black colleagues in the UK by 2025. https://t.co/hfGyWc8xeM,2020,10,1
243,3,1310580612823232512,2020-09-28T14:02:22.000Z,"The Grace Hopper Celebration of Women in Computing #GHC20 is the world’s largest gathering of women technologists. I know this year’s reimagined virtual @GHC will again connect, guide and inspire women in technology. @Accenture_US is a proud partner! https://t.co/cwZUWoGmVB",2020,9,28
244,4,1309628841325985792,2020-09-25T23:00:22.000Z,I agree @ChrstnKlein—initiatives like #SDGAmbition will help companies emerge from the current crisis stronger and better able to take action to address big challenges like climate change and inequality. I appreciated our discussion. It’s time to accelerate for shared success! https://t.co/ZSTBWnOqSG,2020,9,25
245,5,1309225591854559232,2020-09-24T20:17:59.000Z,"Our Q4 &amp; FY20 results demonstrate our relevance and resilience, our ability to pivot rapidly, the power of our relationships with the world’s leading companies and ecosystem partners, and our commitment to being a responsible business. Thanks to our people for always being &gt;. https://t.co/c5QIRmJaSC",2020,9,24
246,6,1307819594749362176,2020-09-20T23:11:04.000Z,"@moiraforbes, thank you for inviting me to share my memory of meeting Ruth Bader Ginsburg. It’s inspiring to see so many women leaders talk about the impact she continues to have on our lives and careers. https://t.co/H4f4ggRDT6",2020,9,20
247,7,1307351548650049536,2020-09-19T16:11:13.000Z,"We have lost a beacon in Ruth Bader Ginsburg, a role model and fierce advocate for equality and for doing something “outside yourself”. Our greatest tribute must be to act—to carry on her fight for equality and justice for all, with more energy than ever—to make enduring change.",2020,9,19
248,8,1306954632758022144,2020-09-18T13:54:01.000Z,"@pauldaugh @Accenture Couldn’t agree more, @pauldaugh. At this critical time, every business must be a #cloud business. I’m delighted @KarthikSNarain will lead @Accenture #CloudFirst—this is a major move to help our clients accelerate their journeys to the cloud and their digital transformations.",2020,9,18
249,0,1299167892282445825,2020-08-28T02:12:17.000Z,An inspiring and important message from the legacy of the 1963 #MarchonWashington through today: We must always keep moving forward. https://t.co/76jOJsMAp3,2020,8,28
250,0,1293266121630593032,2020-08-11T19:20:45.000Z,"RT @APRippert: Welcome to the @Accenture family, @PLMSYSTEMS! Looking forward to maximizing client value from product #data in design, engi…",2020,8,11
251,1,1289353767674994688,2020-08-01T00:14:27.000Z,"RT @Accenture_ME: From our family to yours, we wish you a happy, healthy and blessed Eid. 
#EidMubarak https://t.co/B1ClNsHQGL",2020,8,1
252,2,1289349246144192513,2020-07-31T23:56:29.000Z,"Congrats on two richly deserved #Emmys2020 nods, @mackevision. You develop the technology and make it sing, whether you’re building distant planets or creating unique interactive experiences for our clients. Truly spectacular work. https://t.co/RYJYLQnz9r",2020,7,31
253,0,1284658104567726081,2020-07-19T01:15:34.000Z,John Lewis was a man of rare courage and grace: “Every generation leaves behind a legacy. What that legacy will be is determined by the people of that generation.” May we honor him by choosing our legacy to be ending racism and achieving the equality he fought for all his life.,2020,7,19
254,1,1281680250653614085,2020-07-10T20:02:38.000Z,RT @AccentureACTIVE: Brand purpose must go beyond simply words. Our research shows the actions an organization takes on social issues could…,2020,7,10
255,2,1278809588805054464,2020-07-02T21:55:39.000Z,"@globalcompact @SandaOjiambo Congratulations, @SandaOjiambo. I’m looking forward to partnering with you and seeing how the UN @GlobalCompact will continue to develop under your leadership.",2020,7,2
256,3,1278805910446538752,2020-07-02T21:41:02.000Z,"@marcooziegler This is a great reminder that the work of striving for a culture of equality is ongoing, @marcooziegler. I’m always ready to learn how I can be a more effective ally. Thank you for being a coach and mentor.",2020,7,2
257,4,1278805672973434881,2020-07-02T21:40:06.000Z,"RT @marcooziegler: How can the LGBT+ community thrive in the workplace? We need to work together to support our people through allyship, me…",2020,7,2
258,5,1278804174646521858,2020-07-02T21:34:08.000Z,"As COVID-19 widens the gap between digital leaders and laggards, organizations need to rethink transformation. In @FortuneMagazine, I shared five new rules to help CEOs persevere and prevail in this time of long-term disruption. https://t.co/6JnMo6zFqM",2020,7,2
259,0,1276576057915777027,2020-06-26T18:00:24.000Z,"Congratulations, leaders @Accenture! It was a pleasure to join you last week for your innovative managing director integration seminar and leadership development festival. I can’t wait to see what you accomplish for our people, clients and communities. https://t.co/Eczot1z0PB",2020,6,26
260,1,1276569050030751744,2020-06-26T17:32:33.000Z,"RT @mcarrelb: Much has changed since we published our #TechVision2020 report, and we have seen an incredible acceleration of technology and…",2020,6,26
261,2,1276520666599247872,2020-06-26T14:20:18.000Z,"Thanks for a great @movinonconnect summit Florent Menegaux. @Michelin is leading the way in #SustainableMobility &amp; it was a pleasure to connect with you and @Faurecia's Patrick Koller to discuss our commitment to clients, ecosystem partners &amp; communities. https://t.co/TvfxlT1qoR",2020,6,26
262,3,1276188875900272641,2020-06-25T16:21:53.000Z,"Today we announced our Q3 financial results. I am proud of how our leaders and people have come together amid unprecedented challenges and have continued to deliver on our commitments to our shareholders, our clients, our people and our communities. https://t.co/ffZmjGW59i https://t.co/y3Mj8NjLU3",2020,6,25
263,4,1275614494501285891,2020-06-24T02:19:29.000Z,"We’re seeing an accelerated need for Cloud and for people who can help our clients realize its full value. Welcome to the family @gekko_sas - a great addition to our @Accenture AWS Business Group in France, Belgium, Luxembourg &amp; the Netherlands and our strong @awscloud solutions. https://t.co/VIRbiShX1S",2020,6,24
264,5,1275610140109144066,2020-06-24T02:02:11.000Z,"Thanks for a great conversation @CSIS, @handrewschwartz and Scott Miller. I appreciated the question about opportunities @Accenture is seeing in AI and automation. Along with the imperative to reskill workers, this continues to be a huge area of focus for us and for our clients. https://t.co/MXebqGfK2Y",2020,6,24
265,6,1275605628807974913,2020-06-24T01:44:16.000Z,"Great interview with @Accenture’s Saleem Janmohamed. You’re right: Cloud capability has never been more important, and it’s possible to get up to speed quickly. @theCUBE and @JeffFrick https://t.co/BRbr1HJwXI",2020,6,24
266,7,1275603173231771649,2020-06-24T01:34:30.000Z,"Thanks for an engaging conversation last week on anticorruption and transparency, @wef Partnering Against Corruption Initiative #PACI spring meeting. I was  encouraged by the possibilities around Tech for Integrity. It was an honor to co-chair with you, @PPouyanne #Integrity2030 https://t.co/2eEcWJJGR9",2020,6,24
267,8,1274106384020316160,2020-06-19T22:26:48.000Z,"As a proud LGBTI ally, I’ve long been inspired by our @Accenture people as they support each other across communities. We stand together in our commitment to equality for all in Pride season and every season. https://t.co/F9jYiv60vn",2020,6,19
268,9,1274023082282422272,2020-06-19T16:55:47.000Z,Strongly agree we must push forward @JimFitterling and #SCOTUS decision is significant progress toward #LGBTQ+ equality. https://t.co/3j2S6GqkCC,2020,6,19
269,10,1273945692671746048,2020-06-19T11:48:16.000Z,"#Juneteenth is a time to look ahead with hope but remember where we’ve been. @Accenture, we’ll continue to work together to take action against racism, @JimmyEtheredge. https://t.co/TxH72Y34oP",2020,6,19
270,11,1273799640257892352,2020-06-19T02:07:54.000Z,"@JimmyEtheredge, like you, I’m proud we have Dreamers as part of our @Accenture family. We will continue to advocate for a permanent legislative solution that fully recognizes their value to our communities. https://t.co/cS4TFzor1m",2020,6,19
271,12,1273271959367954432,2020-06-17T15:11:06.000Z,"I agree @JimmyEtheredge, and am proud that Accenture participated through the amicus brief. This news is something to celebrate as we keep working toward equality for all. https://t.co/kmSgtK3st9",2020,6,17
272,13,1273234266604871681,2020-06-17T12:41:19.000Z,Thank you @sarafischer and @axios. Conversations on these important topics are critical as we continue to fight racism and racial inequality. https://t.co/Uunxai42AD,2020,6,17
273,14,1273232945625653248,2020-06-17T12:36:04.000Z,"You’re right @MartinWRodgers. We must speak up, act and work together, and I’m glad to stand together with you as we continue to take action to fight racism inside and outside Accenture. As you say: with light, comes heat. https://t.co/o9IR68cjSZ",2020,6,17
274,15,1271602982870831104,2020-06-13T00:39:11.000Z,"I'm looking forward to the UN @globalcompact #LeadersSummit on Monday, @Lise_Kingo and @peterlacy.  Let’s discuss how businesses can work together to accelerate progress against shared global challenges, like inequality, COVID-19 and climate change. #UnitingBusiness #SDGAmbition https://t.co/DNBMwwrjVX",2020,6,13
275,16,1270807746485551109,2020-06-10T19:59:11.000Z,Thank you @andrewrsorkin for hosting me to talk about the actions we are taking at Accenture and in our communities  to fight racism and create more economic opportunity for African Americans. Black lives must matter inside and outside @Accenture. https://t.co/z4z0sdHJyW,2020,6,10
276,17,1268533136482357251,2020-06-04T13:20:42.000Z,"There’s a time when words are not enough, and that time is now. I’m sharing actions we’re taking to fight racism inside and outside of Accenture, create more opportunities for our communities of color and take a stronger leadership role in our communities. https://t.co/yzkCVUfNc5",2020,6,4
277,0,1263510275204042752,2020-05-21T16:41:39.000Z,"Delighted to be Marc @Benioff's guest on #LeadingThroughChange. Today’s program benefits World Food Program, the world’s largest humanitarian agency working toward #ZeroHunger. For those who give to @WFP, @salesforce will match up to $150,000. To donate: https://t.co/ILB9Etitey https://t.co/FcLRQmJmJm",2020,5,21
278,1,1263491578359840769,2020-05-21T15:27:21.000Z,We’re so pleased the @PLMSYSTEMS team in Italy will join Accenture. Your expertise in product lifecycle management combined with Accenture’s Industry X.0 capabilities means even better solutions for clients to innovate and manage new products. https://t.co/C6bwF8ZePP,2020,5,21
279,2,1263461721148198914,2020-05-21T13:28:42.000Z,Congrats to our own power players @JimmyEtheredge and @APRippert. Your leadership and commitment are always inspiring—thanks for always making a difference. https://t.co/dwrsvXsDYH,2020,5,21
280,3,1263225804395331585,2020-05-20T21:51:16.000Z,"Looking forward to my conversation tomorrow with @Benioff on @Salesforce’s #LeadingThroughChange where we will discuss outmaneuvering uncertainty in these unprecedented times.  
https://t.co/lqp5eVnCYw",2020,5,20
281,4,1263135437058723840,2020-05-20T15:52:10.000Z,"Delighted to welcome @byte_prophecy to our @Accenture family! It’s all about the power of Data, AI and Insights Automation, and we look forward to bringing your expertise our to clients in the growth markets and creating new opportunities together. https://t.co/WPZbXAECGj https://t.co/aLuGXuNmNh",2020,5,20
282,5,1262428798567546881,2020-05-18T17:04:15.000Z,RT @ValaAfshar: .@Accenture’s group chief executive @pauldaugh: We are seeing three years of digital and culture transformation in three mo…,2020,5,18
283,6,1261395346472628224,2020-05-15T20:37:40.000Z,"There are 3 focus areas for our clients right now: collaboration tools, security and the biggest one—cloud. Companies must accelerate moving to the cloud to have the data they need to compete in the new world. Thanks @adsteel for the conversation today. https://t.co/bP0N0cFH9H https://t.co/L3bprAQXF3",2020,5,15
284,7,1261335338292776962,2020-05-15T16:39:13.000Z,"RT @JMOllagnier: We’re proud to join the Business for Inclusive Growth coalition, working together with @OECD to tackle financial, economic…",2020,5,15
285,8,1261282353084805125,2020-05-15T13:08:41.000Z,"People are saying, why is everyone talking about cloud? It's pretty simple. It reduces your cost, it reduces your carbon footprint—innovation is happening in the Cloud. Thanks to @davidfaber @carlquintanilla @CNBC @SquawkStreet for the great conversation. https://t.co/yHXG9vKikR https://t.co/buoyJQrO2z",2020,5,15
286,9,1260929702287589377,2020-05-14T13:47:22.000Z,Great insights from our North America CEO @JimmyEtheredge as companies start the shift to reopen and reinvent their businesses. https://t.co/zJWfERf2Ai,2020,5,14
287,10,1260215113862258689,2020-05-12T14:27:51.000Z,"RT @ValaAfshar: Paul Daugherty is Group Chief Executive at @Accenture. 

He is the bestselling author of ‘Human + Machine’. 

@pauldaugh jo…",2020,5,12
288,11,1258808907629297666,2020-05-08T17:20:05.000Z,Thanks @satyanadella. It was great to share how we are supporting our people and helping our clients pivot to new ways of working. CEOs are seeing the incredible things their organizations can achieve when speed and agility are paramount. Proud to partner with you! https://t.co/1JRyzrB5MC,2020,5,8
