,index,id,created_at,text,year,month,day
289,12,1258752355773931520,2020-05-08T13:35:22.000Z,Welcome to our new colleagues from Callisto Integration! We’re excited to be working with you and look forward to new opportunities to bring your digital manufacturing solutions and expertise to our clients. https://t.co/MFLRVfewBg,2020,5,8
290,13,1258034857424433152,2020-05-06T14:04:17.000Z,"So excited that Kates Kesler, named to Forbes' Best Management Consulting Firms 4 years in a row, is joining Accenture, bringing 10 years of experience in organization design for the world’s leading global companies. A big welcome to the incredibly talented Kates Kesler team. https://t.co/387HwfzX86",2020,5,6
291,0,1257324933622886404,2020-05-04T15:03:18.000Z,Welcome to @Accenture! Never has security been more important. We’re proud you are joining Accenture and helping us keep companies secure so they can do the important work of fighting the health and economic crisis. I look forward to the more secure future we will create together https://t.co/vXqOmHL3j5,2020,5,4
292,1,1256285504359878660,2020-05-01T18:12:59.000Z,"Great to be among the 75M @satyanadella. As the world’s largest corporate user of Teams, it’s been incredibly powerful for our own business continuity and in helping our clients pivot to new ways of working. I’m even becoming a bit of a Teams pro myself! https://t.co/ezWpCoKmhE",2020,5,1
293,2,1253838389297766400,2020-04-25T00:09:01.000Z,@rekha_m_menon - Congratulations and thanks to the entire team. So proud of the impact we can make in helping 1.3 billion people to get the information they need during this critical time. https://t.co/BGjAioYWQ1,2020,4,25
294,3,1253419554761396225,2020-04-23T20:24:43.000Z,"RT @Accenture: While some companies are reducing or furloughing their workforce, others can't hire fast enough. Tune in to our LinkedIn Liv…",2020,4,23
295,4,1252606352452706305,2020-04-21T14:33:21.000Z,"Congrats to you, @ddroga, and to the entire @droga5 team. You are an integral part of our Accenture family and I cannot wait to see what's next. https://t.co/T9zb3TPyO4",2020,4,21
296,5,1251282180753555457,2020-04-17T22:51:34.000Z,"Thanks @emilychangtv and @BloombergTV for the opportunity to talk about what we are doing to support our people and our clients, and how we are partnering with leading companies on People + Work Connect, designed to help get the world get back to work. https://t.co/SPZ0WOfOm3",2020,4,17
