,index,id,created_at,text,year,month,day
0,0,1641459023563362306,2023-03-30T15:15:02.000Z,"With over 3K Amazon electric delivery vans from @Rivian now on the road in 500+ cities, we’re seeing great momentum on our EV deployment. To date, 75M packages have been delivered from our custom vans and will climb faster in the months &amp; yrs ahead! https://t.co/TemBCTRmjQ",2023,3,30
1,1,1638526662701879297,2023-03-22T13:02:53.000Z,"New collaboration with @PaneraBread will let customers, for the first time, use their palm to access MyPanera rewards and pay. One of the many ways Amazon One, our palm recognition service, is helping to remove friction from the customer experience. https://t.co/9kdXctk2hQ",2023,3,22
2,2,1635649475082612737,2023-03-14T14:29:58.000Z,"Today, we're excited to share a first look at our 3 customer antennas for Project Kuiper, Amazon’s forthcoming low Earth orbit satellite network. Good progress in our mission to bring satellite broadband to unserved &amp; underserved communities.  https://t.co/w938BzCAdG",2023,3,14
3,3,1635120537205891074,2023-03-13T03:28:09.000Z,"Congrats to Sarah Polley and the cast and crew of this powerful film! Well deserved, and so happy for our @MGMStudios and @AmazonStudios teams. #Oscars95 https://t.co/1O1rBLl8ho",2023,3,13
4,0,1630301777185898496,2023-02-27T20:20:07.000Z,"Two Amazon Air cargo planes landed in Istanbul this weekend w/ 100,000 pounds of relief supplies including tents, sleeping bags, blankets &amp; heaters. Thx to our teams &amp; partner orgs for this joint effort to help earthquake survivors in Türkiye &amp; Syria. https://t.co/PYZPtKYdYs https://t.co/Nmmk6GvXBG",2023,2,27
5,1,1628410029518000128,2023-02-22T15:03:00.000Z,"Getting great health care is often too difficult and inconvenient. Today, we’re excited to announce that @OneMedical has joined Amazon and our mission to make it dramatically easier for customers to get what they need to stay healthy. https://t.co/IoHWxEZrJY https://t.co/d5IeMZjkWm",2023,2,22
6,2,1625507746648047618,2023-02-14T14:50:21.000Z,Exciting progress by the Zoox team! First time in history a robotaxi has driven autonomously on open public roads with passengers. Congrats to the team and excited for more milestones to come! https://t.co/5HiFwptBr9,2023,2,14
7,0,1622739218207510529,2023-02-06T23:29:13.000Z,"Tragic news out of Turkey and the surrounding region. We’re activating Amazon’s logistics and delivery network to quickly get donated relief items such as blankets, tents, heaters, food, diapers, baby food &amp; medicine to those in need. https://t.co/aQjfJ5vcsF",2023,2,6
8,1,1620954323160281089,2023-02-02T01:16:41.000Z,"Well done, Darrell! https://t.co/fMllQMDxlE",2023,2,2
9,2,1617884854460518404,2023-01-24T13:59:42.000Z,"Nearly half of adults take 2 or more medications daily &amp; many find it hard to afford them. Am excited about launching RxPass to help. For just $5 a month, Prime members can fill all their eligible medications (shipping included, no hidden fees or markups). https://t.co/Xfo4qCV3zw",2023,1,24
10,3,1615014827520581632,2023-01-16T15:55:15.000Z,"Thinking today about Dr. King's legacy and the continued work required to build a more just and inclusive world. Progress has been made, but still a long way to go. Something we’ll all need to be relentless about for many years to come.",2023,1,16
11,0,1612938396594475008,2023-01-10T22:24:15.000Z,"Excited to be expanding Buy With Prime, letting more merchants offer fast, free delivery on their websites to Prime customers. Early tests show shopper conversion increases an avg of 25% when using Buy With Prime. Compelling for merchants &amp; Prime customers.https://t.co/8t8lzgSO9E",2023,1,10
12,1,1609207906263760901,2022-12-31T15:20:37.000Z,"Proud of our Thursday Night Football team for making history this season with 4 of most watched telecasts of 2022, 1st time ever a streamer has had programs on this list. Even more proud of the quality of the broadcast this team produced every week. And, just year one… https://t.co/1nqzyePNg3",2022,12,31
13,2,1605227280691003392,2022-12-20T15:43:02.000Z,Love seeing notes like this from customers who see our @Rivian EV delivery vans out and about. Excited to share that we just hit the 10 millionth package delivered since our first Rivian EV hit the road in July. #ClimatePledge https://t.co/oaURQlcATi,2022,12,20
14,0,1603792146020339712,2022-12-16T16:40:19.000Z,Loved meeting our special group of Amazon Prime members we invited to last night’s Thursday Night Football game. Thank you to the millions of fans who watch @NFLonPrime every week... https://t.co/n2guUDKg4F,2022,12,16
15,1,1600299482494939136,2022-12-07T01:21:43.000Z,"Am excited to see HBO Max back on @PrimeVideo. It’s great for Prime customers, and we continue to work hard to make Amazon an easy one stop shop for customers to enjoy the best and widest selection of premium content available. https://t.co/x5X3fXjZ1J",2022,12,7
16,0,1591081811161264130,2022-11-11T14:53:59.000Z,"Throughout history, brave men and women have answered the call of duty when they’ve been needed most. Thank you to our over 50k Amazon military veterans and spouses, and all who have served. Incredibly grateful for your service. https://t.co/VELFBFKMwr",2022,11,11
17,0,1587449674277191680,2022-11-01T14:21:10.000Z,"Excited about meaningfully enhancing our music benefit for Prime members. Starting today, Prime members can now shuffle play more than 100 million songs (up from 2 million) on @AmazonMusic, and listen to many top podcasts ad-free. https://t.co/b65bmXnFR7",2022,11,1
18,1,1583090508943200256,2022-10-20T13:39:24.000Z,"Loved visiting our Boston Robotics center, where our team is working hard on inventing robotics that help keep our employees safe and improve delivery for our customers. Excited about what the team is working on. https://t.co/4MkICPYPE7",2022,10,20
19,2,1582173599250931712,2022-10-18T00:55:56.000Z,Proud of how Amazon continues to help in times of urgent need…thx to the collective Amazonians who are making this happen! https://t.co/HILRmZZSmf,2022,10,18
20,3,1580229970135506945,2022-10-12T16:12:38.000Z,"Nearly impossible to imagine what it would be like to flee your country &amp; have to start over… to help millions of Ukrainians who now face this &amp; those still in the country, we are offering them free cloud skills training &amp; AWS Certification vouchers. https://t.co/GOvsm08MQK",2022,10,12
21,0,1579785436243070977,2022-10-11T10:46:13.000Z,Excited to be kicking off the holiday season early this year for our Prime members. Prime Early Access sale starts today... https://t.co/K0NwKshw1G,2022,10,11
22,1,1579576205183168513,2022-10-10T20:54:49.000Z,Enjoyed being in Dartford today visiting one of our 30 Amazon fulfillment centers here in the UK (+80 across Europe). Very impressed by the site leadership &amp; thankful for the chance to meet so many of our team members throughout the tour. Thank you for taking care of customers! https://t.co/oltzwllE0B,2022,10,10
23,2,1579320499506933760,2022-10-10T03:58:44.000Z,Amazon is committing €1 billion to further electrify &amp; decarbonize our transportation network across Europe. Will help us shift further away from traditional fossil fuels &amp; scale innovation. Very important we continue to invest in a sustainable future. https://t.co/onnmgR8lI7,2022,10,10
24,3,1575204073338720256,2022-09-28T19:21:31.000Z,Great Amazon Devices event today... here’s a look at the new products we announced and how they further our vision for ambient intelligence—technology that’s there for customers when they need it &amp; disappears when they don’t. https://t.co/PJtOM0Hstm,2022,9,28
25,4,1574941334695448576,2022-09-28T01:57:29.000Z,Thinking of everyone in Florida right now... we have activated our teams to prepare relief items to send to Florida when Hurricane Ian makes landfall. https://t.co/c5aTSLJHeh https://t.co/u3QA3pUdZG,2022,9,28
26,5,1572712933037309952,2022-09-21T22:22:37.000Z,"Hurricane Fiona has left many in Puerto Rico without electricity, shelter &amp; clean water. Amazon has activated our Disaster Relief Hub in Atlanta where hundreds of thousands of much-needed items are being packed for shipping directly to the island to help. https://t.co/ue2l1vWAjL https://t.co/NmBXib3Xjp",2022,9,21
27,6,1572569861175545857,2022-09-21T12:54:06.000Z,"Our first renewable energy project in South America &amp; first solar farms in India &amp; Poland… part of 71 new renewable energy projects. Last yr, Amazon powered 85% of our business w/ renewable energy… w/ today’s additions, closer to our goal of 100% by 2025.https://t.co/kHyWo8aeJz",2022,9,21
28,7,1570568373213491200,2022-09-16T00:20:54.000Z,"Tonight, we kick off a new era of @NFL Thursday Night Football only on @PrimeVideo. Huge team effort getting to this moment, and we can’t wait to deliver a great experience for Prime members this season + the next 10. Giddy up! https://t.co/CBKUcMSbiu",2022,9,16
29,8,1570119739120455680,2022-09-14T18:38:11.000Z,Amazing story &amp; selfless act by Amazon delivery driver Kevin Rivera… grateful to hear everyone is safe and well. https://t.co/e634OW8K3j,2022,9,14
30,0,1567967528668000256,2022-09-08T20:06:04.000Z,"Sad day for so many around the world…On behalf of Amazon, sharing our deepest sympathies for the Royal Family and all of those in mourning. https://t.co/Ru58CUz35B",2022,9,8
31,1,1566436262038622208,2022-09-04T14:41:22.000Z,Congrats team &amp; thanks to all the @PrimeVideo members who tuned in! https://t.co/h3ABy9VNJN,2022,9,4
32,2,1562883320119447552,2022-08-25T19:23:15.000Z,"Amazon continues to invest in range of new technologies to get to net-zero carbon by 2040. Excited about latest step...in 2025, we'll start purchasing ~11K tons of green hydrogen/year -- enough annual power for 30,000 forklifts or 800 heavy-duty trucks. https://t.co/oWwWT0DHk9",2022,8,25
33,3,1559572641974870016,2022-08-16T16:07:47.000Z,Really enjoyed being with the talented cast and creators at #TheRingsofPower premiere. So much care and passion has gone into this project…looking forward to our Prime customers all over the world being able to see. Just a few weeks away from release on @PrimeVideo. https://t.co/iLiv6WrwNW,2022,8,16
34,0,1556025596118896641,2022-08-06T21:13:06.000Z,"Fortunate to know Tom Alberg for the last 25 yrs. His professional &amp; civic accomplishments were many. But, what impressed me most was his character—humble, high integrity, missionary, cared about his community—as good a guy as they come. Learned a lot from Tom. Will miss him. https://t.co/KRLh1TwWAv",2022,8,6
35,1,1554520496833585153,2022-08-02T17:32:22.000Z,"This show truly has been a labor of love for the @PrimeVideo team, with each and every detail obsessed about to bring these characters to life... can’t believe we’re just one month away until #TheRingsOfPower debuts. https://t.co/J2CDkPIQJt",2022,8,2
36,2,1554206731181314049,2022-08-01T20:45:35.000Z,"Really enjoyed spending time with Al Michaels, @KirkHerbstreit, and the rest of the talented production, on-air, and Amazon TNF team yesterday as part of the @NFLonPrime production kickoff this weekend. Think you’re going to like watching this group and what they have planned. https://t.co/GsCAcFjHOn",2022,8,1
37,3,1550116510844129283,2022-07-21T13:52:30.000Z,"Excited about first electric @Rivian vans hitting the roads today to deliver for Amazon customers. Love thoughtful design around safety, driver comfort &amp; low emissions to help us reach our @ClimatePledge. Thx @RJScaringe for the tour and partnership! https://t.co/zeJJHnboct https://t.co/avom4Fdcum",2022,7,21
38,0,1547656716422066182,2022-07-14T18:58:09.000Z,"Think customers really enjoyed Prime Day ‘22—our biggest ever w/ 300M+ items sold &amp; $1.7B+ saved by Prime members. Prime Day is a massive team endeavor—thank you, thank you, thank you to our teams, 3P sellers &amp; delivery partners for your incredible work. https://t.co/3zcxU70YSY",2022,7,14
39,1,1547608858704588800,2022-07-14T15:47:59.000Z,"Getting closer to the launch of The Lord of the Rings #TheRingsOfPower, and can’t wait to share with you all. Here’s a little taste… https://t.co/9GH1Tkry3Y",2022,7,14
40,2,1546858127030566912,2022-07-12T14:04:51.000Z,20 countries…millions of deals…Happy Prime Day! https://t.co/wAPCzRd4Bu https://t.co/ALNq7LlSoO,2022,7,12
41,0,1538587252707581952,2022-06-19T18:19:21.000Z,Juneteenth is not just a lesson from the past…it’s both a time to reflect on this country's painful history of slavery and racism (which we must face &amp; learn from) and a chance to recommit as a nation to confront the inequalities that exist today.,2022,6,19
42,1,1537417332418523136,2022-06-16T12:50:30.000Z,The date for Prime Day 2022 just announced…gonna be a lot of great deals for customers. Giddy up! https://t.co/PkjQzPfcMS,2022,6,16
43,0,1529575185719885826,2022-05-25T21:28:37.000Z,Deeply sad about the shootings in Texas yesterday and Buffalo 11 days ago. My heart breaks for those families. This endless cycle is maddening…terrible pain and suffering. I can only hope that we come together as a country to find a way to stop this kind of tragic violence.,2022,5,25
44,1,1526726630151925763,2022-05-18T00:49:28.000Z,Great progress being made in India...Amazon teams are working hard to make the lives of customers better every day. Excited for everyone joining the #AmazonSmbhav summit - lots of important discussions on how to empower entrepreneurs + SMBs. https://t.co/mxFi2UOQ0W,2022,5,18
45,2,1526390044763623424,2022-05-17T02:32:00.000Z,"If not already watching, recommend you add this to your list. Less than a month until season three begins! https://t.co/0FZrFwMeWl",2022,5,17
46,0,1524030133216055296,2022-05-10T14:14:33.000Z,"Incredible teachers make a real difference in the lives of their students…

Congrats to this year’s #AmazonFutureEngineer Teacher of the Year $30K prize recipients. Thx for helping students see that anyone can pursue a career in computer science.
https://t.co/VY3rA7VbtC",2022,5,10
47,1,1517187522064879621,2022-04-21T17:04:27.000Z,Prime getting even better for members… :) https://t.co/ePn5zJEERx,2022,4,21
48,2,1516847836280672257,2022-04-20T18:34:40.000Z,Another important step toward our mission of running Amazon’s global operations on 100% renewable energy by 2025 – 5 years ahead of our initial goal. https://t.co/rJX0Fd8RKv,2022,4,20
49,0,1515091142747992065,2022-04-15T22:14:12.000Z,https://t.co/Kxq57wYBZG,2022,4,15
50,1,1515091140235595776,2022-04-15T22:14:11.000Z,https://t.co/XZs0mUutGY https://t.co/eypxzj6Y8w,2022,4,15
51,2,1514241735668342785,2022-04-13T13:58:57.000Z,Congrats to Zoey and the rest of this year's 250 #AmazonFutureEngineer $40K college scholarship recipients. Just the beginning of big things for all of you… excited for your Amazon internships to begin. https://t.co/6YyHBHyGHe https://t.co/pC5a47rq0L,2022,4,13
52,3,1511700380421263362,2022-04-06T13:40:31.000Z,"Still plenty more to do, but proud of our incredible teammates who make this a special place to work… https://t.co/DDTH4fVQQA",2022,4,6
53,4,1511356332020051980,2022-04-05T14:53:23.000Z,"Excited for Project Kuiper to partner w/ @Arianespace, @ulalaunch &amp; @blueorigin to deploy 3K+ broadband satellites in the coming years. Scale of this agreement will help us bring fast, affordable broadband to customers in unserved &amp; underserved communities.https://t.co/ApkkFTCLm5",2022,4,5
54,5,1509388863139028993,2022-03-31T04:35:22.000Z,".@ZachPerson here playing between periods at #Kraken game. Imo, best up and coming rock artist around. His self-titled record is fantastic. https://t.co/pohAFFTKGL",2022,3,31
55,6,1508497333872312323,2022-03-28T17:32:45.000Z,"Rain outside not dampening Amazon #MARS2022… some of brightest minds in machine learning, automation, robotics and space. Feel lucky to be surrounded by so many brilliant and accomplished people working on next generation of disruptive inventions. https://t.co/2zjwxrF5WV",2022,3,28
56,7,1507570459658764289,2022-03-26T04:09:41.000Z,"Am so sad and bummed to hear about Taylor Hawkins. Unbelievable musician, force of nature in Foo Fighters, really likable guy, and my thoughts and heart go out to his family (and the band).",2022,3,26
57,8,1506709584563499008,2022-03-23T19:08:52.000Z,"Very excited to have you and Al join the team, Kirk! Looking forward to the start of #TNFonPrime! https://t.co/U1vr9c6gQf",2022,3,23
58,9,1506364616653213699,2022-03-22T20:18:06.000Z,First shipments of critical supplies just arrived at a fulfillment center in Slovakia we’ve converted into a humanitarian aid hub. This will help charities get needed items to Ukrainian families faster. More help coming soon through our logistics network. https://t.co/NPEsI2kzJc https://t.co/AJLPgUOltV,2022,3,22
59,0,1503789173815209988,2022-03-15T17:44:12.000Z,(2/2) Our latest partnership ($124M) will build 1K+ homes next to public transit. https://t.co/PXLsGritxj,2022,3,15
60,1,1503789172657557505,2022-03-15T17:44:12.000Z,"As we continue to increase our focus on the communities in which we have a substantial presence, we’re excited to invest further in affordable housing. To date, we've committed more than $1.2B to create/preserve 8,000+ homes and help ~18K people. (1/2)",2022,3,15
61,2,1503376491098218500,2022-03-14T14:24:21.000Z,Important milestone for the #ClimatePledge - 300+ companies have now joined Amazon in committing to reach net-zero carbon emissions by 2040. Innovation and collaboration are key to solving big global challenges…encouraging to have these companies on board.https://t.co/IcvDZsvVIZ,2022,3,14
62,3,1501211435707293698,2022-03-08T15:01:12.000Z,Appreciative of our incredible women leaders and builders. Our teams are stronger and products are better when they include diverse perspectives and experiences. We’re committed to supporting women and their careers here at Amazon. #InternationalWomensDay #IWD2022,2022,3,8
63,4,1500291207242530817,2022-03-06T02:04:32.000Z,"Good luck to Garfield HS Girls Basketball team in WA State Finals tonight. What a year they’ve had! Same for Boys team, which finished 4th in State tournament + lost only 1 game all year. Impressive to watch hard work/commitment all year by these athletes. https://t.co/bcxrLV5nf1 https://t.co/3UjzJWxgPT",2022,3,6
64,5,1499187647444492291,2022-03-03T00:59:23.000Z,"(2/2) We’re supporting humanitarian relief NGOs on the ground with cash donations from Amazon and our employees, logistics to get supplies to people needing them, and cyber security assistance to companies and governments.",2022,3,3
65,6,1499187646454661124,2022-03-03T00:59:23.000Z,"The situation in Ukraine is deeply concerning, and gets more so each day. Amazon stands with the people of Ukraine, and will continue to help. (1/2)",2022,3,3
66,0,1494380373928603650,2022-02-17T18:37:00.000Z,"Enjoyed visiting w/ @lazowska &amp; @greggottesman's class last night. So impressed w/ @UW and the clever composition of comp sci, design, and MBA students in this class who collaborate to conceive and build real products. I would have loved to take this class when I was in school. https://t.co/BcmVoKwvhY",2022,2,17
67,1,1493413532641030145,2022-02-15T02:35:07.000Z,"Pretty cool to see...over weekend Lost Ark became 2nd highest played game in Steam history (1.325M concurrent players). On the heels of New World success a few mos ago, team has found two games in a row that seem to be resonating with gamers. https://t.co/ZmhtXKE7CW",2022,2,15
68,2,1493037626881830914,2022-02-14T01:41:24.000Z,The first official trailer of The Lord of the Rings 'The Rings of Power' coming to @PrimeVideo Sept. 2. #SBLVI #LOTRROP #LOTRonPrime https://t.co/q0u57pLpLB,2022,2,14
69,3,1493033248150020098,2022-02-14T01:24:00.000Z,Hey #LOTRonPrime fans…be ready during 3rd quarter of #SBLVI. We have something during one of the commercial breaks for you.,2022,2,14
70,4,1491827145110216716,2022-02-10T17:31:22.000Z,Have loved football since my dad took me to my very first @Giants game when I was 3...very excited to have Thursday Night Football come exclusively to @NFLonPrime starting September 15! https://t.co/apP6JUYIU2,2022,2,10
71,5,1491764696151592961,2022-02-10T13:23:13.000Z,"For people excited to see what Middle-earth will look like, here’s a first look at our new @LOTRonPrime series. https://t.co/djLqaNqmZW",2022,2,10
72,6,1491518991109480448,2022-02-09T21:06:53.000Z,"Very cool story about one of our Amazon Delivery Service Partners...in less than 2 years, Jaren has grown his team to almost 80 employees. https://t.co/yQuCxuhfCy",2022,2,9
73,7,1490693657397456902,2022-02-07T14:27:18.000Z,Looking forward to the Super Bowl on Sunday…here’s a first look at one of our new commercials for it. https://t.co/LH9WeDUFRR,2022,2,7
74,8,1489011224364814338,2022-02-02T23:01:55.000Z,"Proud of the fact that Amazon has been voted one of the most admired companies in the world for the sixth year straight (#2). We have a lot to keep working on, and committed to getting better every day, but feel lucky to work with the folks that I do. https://t.co/KqfGAGgCI7",2022,2,2
75,0,1486398825799434240,2022-01-26T18:01:10.000Z,"Our employees are now eligible for fully-funded college tuition from Amazon after just 3 mos (we had Career Choice for yrs, but had a 1 yr requirement). Accessible, affordable education is so important &amp; such a door opener. Hoping this makes it easier for even more employees. https://t.co/rYYtbqz3L5",2022,1,26
76,1,1484182424825188359,2022-01-20T15:13:59.000Z,"Very excited to share this with customers…we're opening Amazon Style, our first-ever physical store for apparel. It will be located in L.A. and use machine learning and a unique store design to create a customized experience for each shopper. https://t.co/rKsQAVPYqW",2022,1,20
77,2,1483816730191298561,2022-01-19T15:00:51.000Z,"A lot of people are excited for the upcoming @LOTRonPrime series (including me!). Today, we officially share its name...Can’t wait for the premiere September 2! https://t.co/SDfpQD53Bt",2022,1,19
78,3,1483144361198043137,2022-01-17T18:29:05.000Z,"“Commit yourself to the noble struggle for equal rights. You will make a greater person of yourself, a greater nation of your country, and a finer world to live in.” -MLK
 
Reflecting on how Dr. King’s ideals of democracy, justice, hope, and love can help us grow as a society.",2022,1,17
79,4,1478796911142268930,2022-01-05T18:33:52.000Z,"Excited to collaborate with @Stellantis to re-invent the driving experience. This partnership will make driving safer, smarter, and more personalized for millions of people. https://t.co/vcs8bkER7b",2022,1,5
80,5,1478713991421595650,2022-01-05T13:04:23.000Z,Alexa has made life easier for customers on Earth...excited to explore what voice &amp; AI can do for astronauts in space. Great partnership with @LockheedMartin &amp; @Cisco for @NASA’s upcoming #Artemis mission! https://t.co/tUfXSJngcH,2022,1,5
81,0,1469735670843203590,2021-12-11T18:27:44.000Z,"(2/2) As this situation continues to evolve, I want our Edwardsville community to know we are working closely with local officials &amp; first responders to support them. My deepest sympathies are with the Amazon community and all impacted.",2021,12,11
82,1,1469735669442711552,2021-12-11T18:27:44.000Z,"We've been closely monitoring the terrible situation in Edwardsville, and are heartbroken over the loss of our team members. Our thoughts are with their families at this difficult time. (1/2)",2021,12,11
83,2,1468641167306682369,2021-12-08T17:58:34.000Z,"Addressing the affordable housing crisis in underrepresented communities starts with removing barriers. Amazon’s new program provides Black, Hispanic &amp; Native American real estate developers w/ training, mentorship &amp; capital to kick-start their projects. https://t.co/GbqbVyHeUp",2021,12,8
84,0,1466435729089712134,2021-12-02T15:54:57.000Z,We've been fortunate to have Grab build their business on top of #AWS for many years now. Am super impressed with @AnthonyPY_Tan and the Grab team and excited for them as they go public today. https://t.co/JbBYkuO74D,2021,12,2
85,1,1465110001161146377,2021-11-29T00:06:59.000Z,Excited for #AWS customers and AWS team as they gather for the 10th annual #reInvent...lot in store for customers and will be fun for the community to be together again. https://t.co/2S9tCHGsOI,2021,11,29
86,2,1463674171238408201,2021-11-25T01:01:30.000Z,"Loved this photo one of our Amazon Air team members took recently in Lakeland, Florida. Sending a big thank you to our teams, partners, and sellers heading into the holidays. Appreciative of all you do for customers… https://t.co/X7rRiJ3Zhy",2021,11,25
87,3,1461494238936326151,2021-11-19T00:39:14.000Z,Good update on last year’s pledge to expand access to free cloud skills training. https://t.co/67k0VVvhXG,2021,11,19
88,4,1458811723456999428,2021-11-11T14:59:52.000Z,This country would not be what it is today without the incredible bravery and sacrifices of our military community. Thank you to all veterans - those at Amazon and beyond - for your service. https://t.co/te21VYvhBp,2021,11,11
89,0,1456276334250917888,2021-11-04T15:05:09.000Z,"We've announced today that Amazon will be a founding member of the First Movers Coalition, leading to more sustainable technologies across freight, ocean &amp; air transport. Energized to see this collaboration as we push toward net-zero carbon. #COP26 https://t.co/rZVHIc8KwE",2021,11,4
90,1,1455216897947942913,2021-11-01T16:55:19.000Z,"Excited to share that Project Kuiper will launch two prototype satellites next fall on ABL Space Systems’ new RS1 rocket…an important step toward making fast, affordable broadband a reality for unserved &amp; underserved communities. https://t.co/SQSw4zkkj1",2021,11,1
