,index,id,created_at,text,year,month,day
91,2,1452071747017007106,2021-10-24T00:37:37.000Z,Pre-game at the arena...new era of NHL hockey in Seattle about to begin. Go Kraken! #seakraken https://t.co/QAWvwLCpdh,2021,10,24
92,3,1451918492060373008,2021-10-23T14:28:38.000Z,Proud of how we’re helping people with Amazon’s Returnship program. Life happens…we want to make it easier for people who’ve taken a break in their careers to come back to work. https://t.co/xAeU9NoXgA,2021,10,23
93,4,1451735976343064581,2021-10-23T02:23:23.000Z,Can’t wait! https://t.co/aJas8wEE08,2021,10,23
94,5,1451340214530576394,2021-10-22T00:10:46.000Z,"So many cool parts of this building: ice rink made from rainwater, powered by 100% renewable electricity, tickets that double as transit passes, etc. Excited to officially open the doors of @ClimateArena tomorrow. Congrats to @OakViewGroup &amp; all involved! https://t.co/dzVeBEK2Gk",2021,10,22
95,6,1450941311335350273,2021-10-20T21:45:40.000Z,"Cool video of @zoox all-electric, fully autonomous robotaxi. Amazon joined forces with Zoox last year and it’s been exciting to see their technology evolve. They’ve just started testing their L3 vehicles in Seattle…the rainy weather should be great training for the fleet and AI. https://t.co/b3I6W3dcSO",2021,10,20
96,7,1448067700513812484,2021-10-12T23:26:58.000Z,"Tonight's beginning for @SeattleKraken is long time in making...takes a village to bring new things to life, and this was no different. Pretty amazing team on + off ice...tonight is a new starting line for the Kraken-- giddy up! https://t.co/fbmsoi2uZW",2021,10,12
97,0,1443213602500931587,2021-09-29T13:58:31.000Z,"Josh’s pioneering work on Alexa’s Show &amp; Tell accessibility feature, which helps customers who are blind or visually impaired identify household items, is just one of the ways he’s made people’s lives better on a daily basis. Congrats on being named a MacArthur Fellow, Josh! https://t.co/2tQlMFAdl1",2021,9,29
98,1,1442901825280118786,2021-09-28T17:19:37.000Z,"Congrats to the Amazon Devices team on the array of amazing products announced today! And, thx for sneak peek on Astro…looking forward to customers getting a chance to benefit from a totally new kind of home robot. https://t.co/4b0MsbGcpI",2021,9,28
99,2,1442872881977835528,2021-09-28T15:24:37.000Z,"Really excited about today’s New World launch. More than 1 million people have been playing in Beta tests, and today, the rest of the world gets to fight for survival. https://t.co/btvzfFelwf",2021,9,28
100,0,1436116919090769942,2021-09-09T23:58:49.000Z,Excited about this… https://t.co/ThSdy3cefs,2021,9,9
101,1,1434358205698625539,2021-09-05T03:30:19.000Z,Many folks have had situations that have gone awry and where you have to improvise...few have done it gracefully as what I'm watching tonight with Dave Matthews... https://t.co/LvuCt0I86W,2021,9,5
102,2,1433559341601226767,2021-09-02T22:35:55.000Z,"Thinking of communities in Louisiana following #HurricaneIda. Our Disaster Relief team sent trucks in &amp; is working w/ @SaveTheChildren…getting 140,000+ Amazon-donated aid supplies like water, hygiene products &amp; diapers to families today. More is on the way. https://t.co/4MjWAemEY1",2021,9,2
103,3,1433061611640475650,2021-09-01T13:38:07.000Z,"Excited to welcome job seekers around the world to Career Day in a few weeks, our big recruiting and training event. With over 55k jobs available globally, look forward to helping people learn more about these roles and launch their next chapters. https://t.co/RcsMCPha9e",2021,9,1
104,0,1430199238449799171,2021-08-24T16:04:04.000Z,"Today is the 15 year anniversary of EC2. Offering developers compute for $0.10/hr was pretty radical back in 2006, it's now become the norm and backbone for so many new and existing businesses. And, the #AWS team isn't close to being done innovating on EC2. Lots more to come.",2021,8,24
105,1,1429644120201383940,2021-08-23T03:18:14.000Z,"RIP Rod Gilbert...an amazing player, a NY Ranger through and through, a class act, and an important figure in my childhood",2021,8,23
106,0,1433559341601226767,2021-09-02T22:35:55.000Z,"Thinking of communities in Louisiana following #HurricaneIda. Our Disaster Relief team sent trucks in &amp; is working w/ @SaveTheChildren…getting 140,000+ Amazon-donated aid supplies like water, hygiene products &amp; diapers to families today. More is on the way. https://t.co/4MjWAemEY1",2021,9,2
107,1,1433061611640475650,2021-09-01T13:38:07.000Z,"Excited to welcome job seekers around the world to Career Day in a few weeks, our big recruiting and training event. With over 55k jobs available globally, look forward to helping people learn more about these roles and launch their next chapters. https://t.co/RcsMCPha9e",2021,9,1
108,2,1430199238449799171,2021-08-24T16:04:04.000Z,"Today is the 15 year anniversary of EC2. Offering developers compute for $0.10/hr was pretty radical back in 2006, it's now become the norm and backbone for so many new and existing businesses. And, the #AWS team isn't close to being done innovating on EC2. Lots more to come.",2021,8,24
109,3,1429644120201383940,2021-08-23T03:18:14.000Z,"RIP Rod Gilbert...an amazing player, a NY Ranger through and through, a class act, and an important figure in my childhood",2021,8,23
110,0,1418048101143564288,2021-07-22T03:19:48.000Z,"Seattle, we now have players on the @SeattleKraken :-). Very impressive work from GM @RonFrancis10 and his amazing Scouting and Analytics teams to assemble this initial Kraken squad…only 3 mos before we release the Kraken at @ClimateArena. https://t.co/wqqsfyS0CP",2021,7,22
111,1,1415105078990573570,2021-07-14T00:25:16.000Z,"Congrats, @JSalke and the @AmazonStudios and @PrimeVideo teams on today’s Emmy nominations! https://t.co/88rdrTLmGG",2021,7,14
112,2,1414985416558579716,2021-07-13T16:29:47.000Z,"Proud that Amazon continues to support our U.S. veterans and military spouses...we employ over 40K, and making a pledge to hire 100K more in the next few years. https://t.co/8s6RXRpcLG",2021,7,13
113,0,1408207463489306624,2021-06-24T23:36:37.000Z,"This is pretty cool, imo…introducing the #AWS Bug Bust Challenge, the world’s first global competition to fix a million bugs so #developers can improve code quality, eliminate bugs, and boost app performance https://t.co/k3IB1dCJDr https://t.co/pHGSt9f3n8",2021,6,24
114,1,1405242003911168000,2021-06-16T19:12:56.000Z,Excited to continue to innovate with Amazon's $2B+ Housing Equity Fund with a new $300 million investment to provide thousands of affordable homes near public transportation. Big step towards empowering communities. https://t.co/JeuTi3yBsp,2021,6,16
115,2,1405027721504202757,2021-06-16T05:01:27.000Z,"Black-owned businesses are too often locked out of traditional ways of accessing capital, mentorship, and resources. We're committed to changing that. Proud of our Black Employee Network and Seller teams for making this accelerator a reality. https://t.co/Cw9iqvbq2E",2021,6,16
116,0,1397069849600266240,2021-05-25T05:59:43.000Z,"Hard not to love @brandicarlile if you're a music fan, but also if you ever get a chance to talk with her. Smart, thoughtful, authentic. Can see it in her memoir Broken Horses, and in the interview she did with me today. Thx for stopping by Amazon, Brandi! https://t.co/F4QqUiwxa1",2021,5,25
117,0,1392716240632705025,2021-05-13T05:40:01.000Z,"Ever thought about how many scenarios come into play when matching 32 teams across 17 games during an 18-week period… all while optimizing for fairness, travel, &amp; venue availability? Customers like @NFL don't have to w/ #AWS #compute https://t.co/emobvio7s0",2021,5,13
118,1,1392483616442118144,2021-05-12T14:15:39.000Z,"Congratulations to Samuel, Kelly, and all 100 #AmazonFutureEngineer 2021 scholarship recipients. An education in computer science can unlock so many opportunities, and I can’t wait to see these incredible students at Amazon for their internships. https://t.co/3Pr8VzYXD8 https://t.co/jox5mnueO9",2021,5,12
119,2,1389941931195703297,2021-05-05T13:55:54.000Z,Amazon has joined The Global Task Force led by @USChamber to help source and deliver medical equipment to India. 1000 ventilators are on their way to local hospitals in India with the first 100 arriving today. The challenges in India will take continued focus--more help is on way https://t.co/5JAZegAjqp,2021,5,5
120,3,1387473970488745984,2021-04-28T18:29:07.000Z,Proud of this one...lucky to work with the teammates I do on the customer missions we're aiming to solve... https://t.co/SzTp0cEVCe,2021,4,28
121,4,1386779078708006913,2021-04-26T20:27:52.000Z,"Very serious situation in India. Our teams are moving fast to provide support for the latest wave of #COVID19, and using our global and India-wide operations network to transport medical supplies. This is just one step, more help is on the way. https://t.co/h6vomC2JTm",2021,4,26
122,0,1385014949324345352,2021-04-21T23:37:50.000Z,"Excited about teaming up with @DISHNews for telecom 1st...DISH will leverage #AWS infrastructure to build 1st cloud-based 5G network from ground-up (leveraging AWS for RAN and Core, too). Beginning of shift in how telco networks will be built... 
Link: https://t.co/rpHZ5CJmt9",2021,4,21
123,1,1382792217287225345,2021-04-15T20:25:30.000Z,"Thanks to @AmitAgarwal and the Amazon India team for having me. Their investment in small and medium businesses is driving remarkable innovation and economic growth in India, and the new Smbhav Venture Fund will keep that momentum going https://t.co/5ZhWXzsNxY",2021,4,15
124,2,1379172927728279552,2021-04-05T20:43:44.000Z,Excited to expand our relationship and can’t wait to see all the #5G use cases that Private MEC will enable... https://t.co/gj39CX7xjS,2021,4,5
125,3,1377788340842323969,2021-04-02T01:01:53.000Z,Pretty awesome...40% cost savings on compute is a big deal (courtesy of #AWS Graviton2 chips) https://t.co/xRcgSO94Zm,2021,4,2
126,0,1372655139115307012,2021-03-18T21:04:22.000Z,"The increasing anti-Asian violence in this country is pretty shocking and deeply concerning. At Amazon &amp; AWS, we stand in solidarity w/ the Pan-Asian community. #StopAsianHate https://t.co/7IpJMP6ePm",2021,3,18
127,1,1371992900658098181,2021-03-17T01:12:52.000Z,"Like Don, am pretty excited about the new x2gd instances...really substantial compute savings-- driven again by graviton2 chips https://t.co/zu6PuJPtml",2021,3,17
128,2,1371522525331558403,2021-03-15T18:03:46.000Z,"Pretty cool to see 12 Oscar nominations for @PrimeVideo, including Sound of Metal for Best Picture. Congrats, team! #OscarNoms https://t.co/moZjeHq3ix",2021,3,15
129,3,1369051665806946306,2021-03-08T22:25:27.000Z,"Happy #InternationalWomensDay. I’m fortunate to have been shaped by many smart, courageous, resilient women throughout my life &amp; career at Amazon.",2021,3,8
130,0,1366874034323922945,2021-03-02T22:12:19.000Z,Teeing off @AWScloud’s collaboration w/ the @PGATOUR to change the way golf fans connect – giving them real-time access to virtually every moment on the course &amp; letting *them* determine how they experience the game ⛳ #sports #digitaltransformation https://t.co/RtdpFLWx0m,2021,3,2
131,1,1366478506993979399,2021-03-01T20:00:38.000Z,Congratulations to the @AmazonStudios team on a great night! #GoldenGlobes https://t.co/B4XB5NzTdj,2021,3,1
132,2,1365440917197320194,2021-02-26T23:17:37.000Z,"@hadip @amazon @jeffawilke Thanks to you &amp; the whole team, Hadi. We're passionate about the mission of helping all students have access to learning CS.",2021,2,26
133,3,1365035995154980865,2021-02-25T20:28:37.000Z,"Excited about the release of Amazon Lookout for Vision, a new industrial #machinelearning service that uses #AWS-trained computer vision models to help customers like @GEHealthcare spot defects or anomalies in products &amp; processes https://t.co/NhegQbmaMi",2021,2,25
134,4,1364286731848085504,2021-02-23T18:51:18.000Z,Really cool to be a part of this historic mission to bring the images &amp; sounds of #Mars back to Earth w/ @NASAJPL @NASAPersevere #CountdownToMars #AWS #space https://t.co/9fFJmHeT5y,2021,2,23
135,5,1359677850727579649,2021-02-11T01:37:15.000Z,Enjoyed chatting w/ @CommissionerNHL to announce how @AWScloud will support the @NHL in its digital transformation. Look forward to seeing goal &amp; faceoff probability stats in action in an upcoming @SeattleKraken game :-) #AWS #machinelearning https://t.co/30i2yrtGnY,2021,2,11
136,6,1357873685080674306,2021-02-06T02:08:09.000Z,"OK, that was an action-packed week :-)...Grateful for all the people who’ve reached out, to Jeff for (the first) 24 yrs of learning &amp; partnership, and for the opportunity to work with the incredible teams across Amazon. Excited for what the future holds.",2021,2,6
137,0,1339746282345099264,2020-12-18T01:36:19.000Z,"Well, that was a new experience. We would have liked to have been w/ you in Vegas for #AWS #reInvent, but did our best to bring 3 weeks of hopefully interesting content/learning. Appreciate so many of you (540K registered, over 300K participating in some fashion) engaging w us.",2020,12,18
138,1,1338969724764315648,2020-12-15T22:10:33.000Z,"Really excited about working w/ @paraga &amp; the whole @Twitter team to help power the real-time, global traffic of this vibrant platform w/ @AWScloud services &amp; #infrastructure. #AWS #reInvent https://t.co/ACrq0wc2Tq",2020,12,15
139,2,1338569385061937155,2020-12-14T19:39:45.000Z,"While @Werner’s keynote at #AWS #reinvent may look a little different this yr (hint: location isn’t where you’d expect), think developers and builders will find it inspiring. Worth watching live tomorrow AM. https://t.co/atZloDrECJ",2020,12,14
140,3,1337919116997324802,2020-12-13T00:35:49.000Z,"AWS training team has been helping people by the thousands for years, now setting a bigger goal-- 29m by 2025. Could have big impact on a lot of people’s lives. Good discussion here with @JonFortt &amp; @TeresaCarlson.  #AWS #reInvent https://t.co/08nJNzTVU2",2020,12,13
141,4,1337107243133591553,2020-12-10T18:49:43.000Z,"Thanks for having me, @jchatterleyCNN. Was great chatting with you about #AWS &amp; the ability for #cloud to #reInvent almost every industry during the most critical &amp; challenging times, including in the wake of the current #COVID19 pandemic. https://t.co/2lPYJr5Yqj",2020,12,10
142,5,1336843110672859136,2020-12-10T01:20:09.000Z,Looking forward to Peter’s #AWS #reinvent keynote on AWS #infrastructure. He's prepared a really interesting talk...recommend tuning in live. https://t.co/qGIEkaSX9E,2020,12,10
143,6,1336731511135981569,2020-12-09T17:56:42.000Z,"Looking forward to working w/ you, Phil, &amp; entire team at @ViacomCBS to reinvent your broadcasting operations (very exciting what you're doing)... #AWS #reInvent https://t.co/tIC3nb8AgX",2020,12,9
144,7,1336435104172765184,2020-12-08T22:18:53.000Z,"We’re teaming up w/ @BMWGroup to develop cloud-enabled solutions for the #auto industry &amp; to upskill up to 5,000 #BMWGroup employees &amp; affiliated software engineers in #cloud tech to help them make better use of #data #machinelearning. https://t.co/7Y6mrDHZFk #AWS #reInvent",2020,12,8
145,8,1336325479175868416,2020-12-08T15:03:16.000Z,"Am excited for Swami's #AWS #reinvent keynote this AM (just an hr away at 8a PST). It's an interesting talk (with a lot of goodies for you, too). This is 1st time we've done #machinelearning as its own mainstage keynote. Enjoy!",2020,12,8
146,9,1335803259672358912,2020-12-07T04:28:09.000Z,"Really looking forward to hosting the incredibly talented @brandicarlile for a night of music &amp; conversation – join us Monday, Dec. 7 at 8pm PT at #AWS #reInvent https://t.co/kCuwhuWWkn https://t.co/x9GWi9npAr",2020,12,7
147,10,1335409534760669184,2020-12-06T02:23:38.000Z,very clever musical rendition of #aws #reinvent keynote-- nice! https://t.co/035OehtaAz,2020,12,6
148,11,1334924056743690240,2020-12-04T18:14:31.000Z,"Well-deserved recognition for a terrific leader. We have a lot of work to do, Angelina, but committed to working with you &amp; the entire Amazon Black Employee Network (BEN) to make meaningful change. https://t.co/xAYd6dRlEQ",2020,12,4
149,0,1334300838655717376,2020-12-03T00:58:04.000Z,Some good stuff planned in tomorrow morning’s @AWScloud #reInvent live Partner Keynote. I’ll be making a guest appearance as well. Join us - should be a good one to learn how #AWS is helping partners modernize in order to help their customers https://t.co/IYGktr8oR2,2020,12,3
150,1,1334210913105108992,2020-12-02T19:00:44.000Z,Love how big @boomaero is thinking and believe what they're doing is one of the more audacious initiatives I've seen in a while...excited to support the #innovative work they're doing w/ the next generation of supersonic #travel. #AWS #reInvent https://t.co/7xUUboNdgs,2020,12,2
151,2,1334191176883191808,2020-12-02T17:42:19.000Z,Excited about new partnership announced yesterday w/ @BlackBerry IVY...much easier for automakers to create personalized driver/passenger experiences &amp; improve operations of #cloud-connected vehicles w/ new BlackBerry QNX &amp; #AWS technology cc. @JohnChen https://t.co/jaPiikPQYV,2020,12,2
152,3,1333639700590956544,2020-12-01T05:10:57.000Z,"New Mac instances (EC2 Mac instances) enable customers to build, test, &amp; run macOS workloads in the #AWS cloud for the 1st time -- extending the flexibility &amp; scalability of AWS to all @Apple #devs, w/ pay-as-you-go pricing. #reInvent https://t.co/cnFD7XRsQq",2020,12,1
153,4,1333567631400452097,2020-12-01T00:24:34.000Z,Less than 24 hrs before my #AWS #reinvent keynote tomorrow morning...looking forward to being with many of you virtually (and live)... https://t.co/pR6VGYwgwF,2020,12,1
154,5,1331469988494860288,2020-11-25T05:29:17.000Z,Proud to support two #tech-forward international #ecommerce powerhouses in @Mercadolibre @ZalandoTech #retail #AWS #reInvent https://t.co/LQzxUbNHn7,2020,11,25
155,6,1329908966017548291,2020-11-20T22:06:20.000Z,"Customers really getting value and leveraging our #AWS Inferentia #machinelearning processors, which deliver 25% lower end-to-end latency &amp; a 30% reduction in costs for inference over the leading GPU-based models https://t.co/ysWfS5A28D",2020,11,20
156,7,1329175734225563649,2020-11-18T21:32:44.000Z,"People quickly flocking to #AWS Network Firewall, a new high-availability managed #security service letting customers enable network protections across their AWS workloads w/ just a few clicks and without needing to maintain underlying infrastructure https://t.co/pithW3hON5",2020,11,18
157,8,1328151514775388166,2020-11-16T01:42:51.000Z,Super cool and innovative work going on w/ @Carrier to develop &amp; prepare to globally distribute the #COVID19 vaccine. Carrier’s Lynx platform will use #AWS #IoT #machinelearning #analytics to improve transport of temp-controlled goods like vaccines. https://t.co/r4OM8grb8b,2020,11,16
158,9,1327442819330445313,2020-11-14T02:46:45.000Z,"Since we launched EC2 Inf1 instances powered by #AWS Inferentia, customers like @Snapchat, @CondeNast, &amp; @AnthemBCBS have used Inf1 for #ML inference at lower cost. Now #Alexa runs the majority of its inference workloads on Inf1, as well. https://t.co/YiyEXD776T",2020,11,14
159,10,1326980012684103680,2020-11-12T20:07:43.000Z,Excited to support leading international #banking institution @StanChart - this time deepening our relationship to deliver new digital services for their customers w/ enhanced #security &amp; #reliability. #AWS https://t.co/zkVryvmnJQ,2020,11,12
160,11,1326726094100180992,2020-11-12T03:18:44.000Z,"Excited to give customers #AWS Glue DataBrew, a new visual prep tool that enables data scientists/analysts to clean &amp; transform #data up to 80% faster than traditional approaches, without writing any code https://t.co/zLIC2vqd7n",2020,11,12
161,12,1326725968107462656,2020-11-12T03:18:14.000Z,@ThatEricAlper New Way Home by Foo Fighters,2020,11,12
162,13,1326600787938615296,2020-11-11T19:00:49.000Z,"Congratulations to #AWS customer @CapitalOne. Love how their leadership describes it here – ""It was a cultural shift for us just as much as it was a technology journey” – proud to be a part of both #cloud #finserv #banking  https://t.co/8ciWFwTHTx",2020,11,11
163,14,1325989822771548161,2020-11-10T02:33:04.000Z,Some pre- #reInvent #storage goodies today… #AWS https://t.co/LmQ3AtPJQD,2020,11,10
164,0,1323662590199820288,2020-11-03T16:25:28.000Z,"Excited to give customers Amazon EC2 P4d instances, the next generation of GPU-powered instances w/ 3x faster performance, up to 60% lower cost, &amp; 2.5x more GPU memory for #machinelearning training &amp; #HPC workloads vs previous generation instances #AWS https://t.co/nPfDc7IwFk",2020,11,3
165,1,1323323008728010752,2020-11-02T17:56:06.000Z,"Happy to announce our upcoming #AWS region in Switzerland...will help Swiss #developers, institutions, innovative #startups, &amp; world-leading pharma companies deliver #cloud-powered applications &amp; fuel economic development across the country https://t.co/DPCdTPGuMW",2020,11,2
166,2,1321161798876213248,2020-10-27T18:48:13.000Z,Pretty cool Coca-Cola Freestyle launch of their new mobile pour solution (concept to cup in just 100 days)! #AWS #CPG @ccfreestyle https://t.co/S5HTuEavbG,2020,10,27
167,3,1319765667659198464,2020-10-23T22:20:29.000Z,"So many goodies lining up for re: Invent that I’ve decided not to skimp on my #AWS #reinvent keynote. Like always, it’ll be live + packed full of launches, w enough goodies left over to make all 3 weeks action-packed. Different challenge this year, but looking forward to it.",2020,10,23
168,4,1318930486517927937,2020-10-21T15:01:47.000Z,"Think there's something to this new #AWS chip, Graviton 2 ? Here's yet another example of how Graviton 2 is changing the game for customers on price performance of compute... https://t.co/IicXtN5fH6",2020,10,21
169,5,1317244525996244992,2020-10-16T23:22:22.000Z,Excited to help @TakedaPharma's cloud-driven biz transformation and the innovative new therapies that they'll enable for people...  #AWS #biotech https://t.co/bexMImdZYQ,2020,10,16
170,6,1316884394947145729,2020-10-15T23:31:20.000Z,Another compelling example of how customers are changing their cost/performance capabilities w/ #AWS Graviton2 https://t.co/QajkujQuLK,2020,10,15
171,0,1314921201123364864,2020-10-10T13:30:19.000Z,This is what we mean when we say game changer...graph is pretty compelling. Love seeing customers getting cost savings like this w/ #AWS Graviton2-based instances https://t.co/pqWbDkuTSB,2020,10,10
172,1,1314565228399452161,2020-10-09T13:55:48.000Z,"Excited to support @Carrier’s new Lynx platform which will use #AWS #IoT + #machinelearning to provide greater connectivity, visibility, intelligence across the cold chain to improve safe transport of temp-controlled items like food, vaccines, etc. https://t.co/gQDq2le0xJ",2020,10,9
173,2,1311478600076455936,2020-10-01T01:30:39.000Z,"Excited to announce GA of Amazon Timestream, new #serverless #database for #IoT &amp; operational apps that can process trillions of time series events/day up to 1,000x faster than relational DBs (and for 1/10th the cost). #AWS  https://t.co/DtSBh9zv9L",2020,10,1
174,3,1309176508657930242,2020-09-24T17:02:57.000Z,6/6 Think if this “suspect” were a white celebrity that they would have come in shooting things up because that person was surprised and shot at them? They would have been more careful. We have to prioritize *all* human lives over investigations. Black lives indeed matter.,2020,9,24
175,4,1309176453703938048,2020-09-24T17:02:44.000Z,"5/6 Guardians of people seek to cool things down in that situation, not escalate further by shooting everything up. They pull back + talk with “suspects” (while still surrounding house). There was no hostage or imminent threat that couldn't tolerate backing off + talking through.",2020,9,24
176,5,1309176407721832448,2020-09-24T17:02:33.000Z,"4/6 With a guardian mindset, we don't barge into somebody's home to investigate drug possession and shoot down two people b/c somebody is surprised and shoots at you.",2020,9,24
177,6,1309176377556508676,2020-09-24T17:02:26.000Z,"3/6 Defunding the police isn’t the answer, imo. Instead, we need culture change in many police depts. Need to move from being authoritarians to guardians.",2020,9,24
178,7,1309176287567675392,2020-09-24T17:02:04.000Z,"2/6 Being a police officer is a dangerous and thankless job. But, it doesn't make you above the law or ramifications if you make a mistake and erroneously take somebody's life. Nobody can be above the law. Our Democracy doesn't work otherwise.",2020,9,24
179,8,1309176233117257728,2020-09-24T17:01:51.000Z,"1/6 Can't let Breonna Taylor death go with no accountability. We still don't get it in the US. If you don't hold police depts accountable for murdering black people, we will never have justice and change, or be the country we aspire (and claim) to be.",2020,9,24
180,9,1307097100694544384,2020-09-18T23:20:08.000Z,This is one of the more clever things I've seen all year...AWS Heroes community member @jeremy_daly's creative take on #AWS #serverless (a parody of “My Shot” from Hamilton called “LAMBDA - A Serverless Musical”) https://t.co/ePocN03xaO,2020,9,18
181,10,1305941198998102017,2020-09-15T18:46:59.000Z,"Expanding our Graviton2-based instances w/ the launch of new Amazon EC2 T4g burstable instances. With 4 instance types offering our game-changing Graviton2 chips, customers are enjoying 40% better price performance for a wide range of workloads https://t.co/XeWhTNd0To",2020,9,15
182,0,1303925638043021320,2020-09-10T05:17:52.000Z,"@Gr8fulJ @Giants @NFL @NextGenStats True, JD...",2020,9,10
