,index,id,created_at,text,year,month,day
277,1,1134045333217062913,2019-05-30T10:34:11.000Z,"Customers like @PwC &amp; @globeandmail excited about general availability of Amazon Textract, a new #AWS #machinelearning service that offers ability to extract text &amp; data, including from tables &amp; forms, in virtually any document w/ no ML experience required https://t.co/HQb7vErkWR",2019,5,30
278,2,1131611800405807104,2019-05-23T17:24:12.000Z,"With #AWS Ground Station, we’re excited to make space communication ubiquitous &amp; ground stations simple and easy to use so more organizations can derive insights from satellite data to improve life on earth and embark on deeper space exploration. https://t.co/dmPGV0bYBB",2019,5,23
279,3,1129382544196038656,2019-05-17T13:45:56.000Z,Amazing work from students at St Mary's Primary School in England who took 1st in their category at the Raspberry Pi National Competition by developing an #RFID device connected to the #AWS cloud to help children safely walk to school #STEM #cloudcomputing https://t.co/bSt6kYBDSw,2019,5,17
280,4,1128813114281959424,2019-05-16T00:03:13.000Z,Congratulations to #AWS customer &amp; Indian OTT/streaming giant @hotstartweets for breaking the global record for simultaneous streams w/ 18.6 million users watching the Indian Premier League #cricket tournament finals this past weekend: https://t.co/gHTMGVGbpe,2019,5,16
281,0,1127977668379459584,2019-05-13T16:43:27.000Z,"We are thrilled to support @seattleu as they expand #computerscience, #engineering, &amp; #STEM #education programs, so everyone – including women &amp; underrepresented minorities – has the resources &amp; skills to build their best future: https://t.co/rRAxDhroiA. #Amazon #AWS",2019,5,13
282,1,1126233551198773248,2019-05-08T21:12:57.000Z,"Proud of the role #AWS continues to play in empowering builders. With AWS, any #startup or #entrepreneur has the technology resources &amp; capabilities once only available to big companies: https://t.co/6U9djgAQnN",2019,5,8
283,2,1121279985434513410,2019-04-25T05:09:15.000Z,"Today’s #AWS Asia Pacific (Hong Kong) Region launch marks 8th AWS Region in Asia Pacific &amp; mainland China (along w/ Beijing, Mumbai, Ningxia, Seoul, Singapore, Sydney, &amp; Tokyo). AWS now spans 64 Availability Zones across 21 regions globally: https://t.co/rgJ0XEby8y.",2019,4,25
284,3,1121151680458838016,2019-04-24T20:39:25.000Z,"Insurance technology leader @Vertafore announced #AWS as their preferred cloud provider, standardizing on AWS for #AI &amp; #ML workloads, to accelerate its pace of innovation, unlock data-driven insights, and automate insurance processes in the cloud: https://t.co/DaE1t259MR.",2019,4,24
285,4,1120870013051650048,2019-04-24T02:00:10.000Z,"Today @Ford &amp; Autonomic, creators of the Transportation Mobility Cloud (TMC), announced that TMC will be powered by #AWS. We're excited to collaborate with Ford on reinventing vehicle connectivity &amp; mobility experiences: https://t.co/wN3jHm8Sih.",2019,4,24
286,5,1120455436157714432,2019-04-22T22:32:47.000Z,@RainierScholars @amazon It's an honor for Amazon to be involved in the amazing work Rainier  Scholars is doing in the Seattle community. There is no bigger game  changer for people in this country (esp for those not living in affluent zip codes) than having access to fantastic education.,2019,4,22
287,0,1117146124165365760,2019-04-13T19:22:46.000Z,"How can CBS not be showing Tiger live on this broadcast? I get he's not leading, but 3 back + most compelling figure in sports (forget golf)",2019,4,13
288,1,1114169943937785856,2019-04-05T14:16:29.000Z,Congrats Arthur Pace for winning Paris #AWS DeepRacer League stop--see you@ Championship Cup at re:Invent 2019! https://t.co/YRlrK8VVU5,2019,4,5
289,2,1113806191094718464,2019-04-04T14:11:04.000Z,"In 1st week of availability, #AWS S3 Glacier Deep Archive has grown 3x faster than any other storage class in 13 yrs since S3’s launch. Not shocking given Deep Archive is lowest cost storage in cloud &amp; better than on-prem tape. But, still interesting how quickly it's taken off.",2019,4,4
290,3,1113077823508426754,2019-04-02T13:56:47.000Z,RT @amazonnews: The first 100 recipients of the Amazon Future Engineer college scholarship have been announced. Congratulations to these de…,2019,4,2
291,4,1112098839891075072,2019-03-30T21:06:39.000Z,RT @Werner: Congrats to the @Amazon Fulfillment teams for completing the migration off Oracle to 100% #AWS. #databasefreedom https://t.co/V…,2019,3,30
292,5,1111301459453206528,2019-03-28T16:18:09.000Z,Congrats to DeepRacer League winner from Santa Clara #AWS Summit yesterday...Chris Miller took home top prize. https://t.co/OisxB4kisE,2019,3,28
293,6,1111038147066920960,2019-03-27T22:51:51.000Z,"Excited that leading African bank, Standard Bank, has chosen #AWS as its preferred provider as it makes its significant shift to the Cloud https://t.co/2Yyd65aIlN",2019,3,27
294,7,1110898969796763649,2019-03-27T13:38:48.000Z,Pretty revolutionary partnership between Volkswagen and AWS...very excited about helping Volkswagen reinvent how their  cars are made...https://t.co/9MqGI3KVOS,2019,3,27
295,0,1105897336679493632,2019-03-13T18:24:06.000Z,@DGoodison it was Shawn Colvin at the Beacon in NYC.,2019,3,13
296,1,1104170607250354176,2019-03-09T00:02:41.000Z,"On this International Women's Day, am reminded of how appreciative and honored I am to work with the group of women I do every day at #AWS.  Here are a few stories of their stories: https://t.co/q7XLgFL9iB",2019,3,9
297,2,1104035932305387526,2019-03-08T15:07:32.000Z,"Cool story on how one of the earliest adopters of #AWS in India, startup @redBus_in, uses Amazon SageMaker to improve conversion + click-through rates &amp; decrease go-to-market from months to weeks. Worth a watch: https://t.co/SdeQLlQMZO #cloudscale",2019,3,8
298,0,1094808430961778688,2019-02-11T04:00:45.000Z,"Watching that Grammys performance, hard not to love Brandi Carlile...just so good.",2019,2,11
