,index,id,created_at,text,year,month,day
183,1,1303902187777478656,2020-09-10T03:44:41.000Z,"As a huge football fan (Go @Giants!) I know the 2020 season may feel a bit different – but we’re proud to continue partnering w/ the @NFL to bring @NextGenStats to life &amp; enhance the experience for fans, players, coaches, broadcasters &amp; more #AWS https://t.co/KWKGJm7agl",2020,9,10
184,2,1301327657183838208,2020-09-03T01:14:25.000Z,"Excited to support @weta_digital – the #visualeffects company known for The Lord of the Rings &amp; Avatar – as they go all-in on #AWS to accelerate innovation &amp; content production, while enabling artists globally to create and render visual effects https://t.co/MyV3f121dx",2020,9,3
185,3,1301006116415971330,2020-09-02T03:56:44.000Z,Thrilled to support @telefonica_de &amp; their cloud native #5G core network deployments — #AWS delivers full automation &amp; elasticity w/ the ability to dynamically scale &amp; allocate 5G network capacity to meet the needs of their biz customers https://t.co/TIJq0mdEFK,2020,9,2
186,4,1300574504314261504,2020-08-31T23:21:39.000Z,"Excited to give the #opensource community Bottlerocket, a Linux distribution built to run #containers, making it easier to manage large, distributed environments at scale &amp; automate updates https://t.co/37T1BBuIYP",2020,8,31
187,5,1298432487408861184,2020-08-26T01:30:03.000Z,"Excited to give customers like @salesforce &amp; @bmsnews even more durability, performance, &amp; value w/ Amazon EBS io2 volumes, delivering 100x the durability &amp; 10x the IOPS-to-storage of previous highest durability volume @ the same cost #AWS https://t.co/f4t9E5m2UQ",2020,8,26
188,6,1295765139363258368,2020-08-18T16:50:58.000Z,"Excited to deepen our #AWS partnership with Toyota...
https://t.co/OfErMDzjAV",2020,8,18
189,0,1294304607456264193,2020-08-14T16:07:20.000Z,"When discontinuous events happen, those that step back, think about, and move forward on strategic initiatives that permanently evolve the business are ones that usually succeed long term. #AWS customer @IHSMarkit did just that in uncertainty of #COVID19-- https://t.co/kfZS31wSSP",2020,8,14
190,1,1294012067788120064,2020-08-13T20:44:53.000Z,"Excited to give developers Amazon Braket to get started with #quantumcomputing on #AWS. Still early days, but has potential to be a game changer in computing. Cool to see customers like at @Fidelity and @vw starting to experiment https://t.co/dKnROzyIs6",2020,8,13
191,2,1293272300276469760,2020-08-11T19:45:18.000Z,It’s cool to have Sourdough Jack aboard! @jackbox #AWS ... https://t.co/vhnInek4qh,2020,8,11
192,3,1291486875304173568,2020-08-06T21:30:40.000Z,"Excited to announce AWS Wavelength in Boston &amp; the SF Bay Area – bringing #AWS compute &amp; storage to the edge of @Verizon's #5G network for customers w/ ultra-low latency use cases like autonomous driving, live event streaming, smart factories &amp; more https://t.co/FwawZTXOLb",2020,8,6
193,4,1291185123241553921,2020-08-06T01:31:37.000Z,How can you not love what @moderna_tx is doing to accelerate the development of vaccines...excited that we are helping #AWS #cloud #technology #COVID19 https://t.co/202pbPCtRU,2020,8,6
194,5,1290445482678943749,2020-08-04T00:32:33.000Z,Look forward to working w/ @GlobalPayInc to bring #payment issuer solutions to new geographic regions &amp; more customers throughout the world #tech #AWS https://t.co/GRU3w04sPL,2020,8,4
195,6,1288523993956282368,2020-07-29T17:17:14.000Z,Companies lose tens of billions to fraud every yr. Excited to give customers Amazon Fraud Detector so they can more easily identify identity &amp; payment fraud w/ the same #machinelearning &amp; expertise developed over 25 yrs running https://t.co/Zxxvz1iy7W #AWS https://t.co/1k99UOmcGJ,2020,7,29
196,7,1286435196137398272,2020-07-23T22:57:06.000Z,"Amazon Connect continues growing quickly b/c people love getting scale/perf/cost structure https://t.co/Zxxvz1iy7W has for its call center tech, and b/c Connect keeps innovating fast. Next up for Connect: Contact Lens (ML-powered analysis of CS calls) #AWS https://t.co/xuVFFWGz94",2020,7,23
197,0,1283826608785088512,2020-07-16T18:11:30.000Z,Excited about the release of Amazon Interactive Video Service (Amazon IVS) which uses the same technology as @Twitch to give customers the ability to add live &amp; interactive #video in their mobile &amp; web applications in minutes #AWS #livestreaming https://t.co/U6iPaVUOzy,2020,7,16
198,1,1281652193540444160,2020-07-10T18:11:09.000Z,"Excited about GA of #AWS IoT SiteWise, which eanbles customers across industries to easily collect, organize, &amp; monitor data from industrial equipment at scale #iot #awsIoT
https://t.co/LU3gR1FlMh",2020,7,10
199,2,1278074361925136384,2020-06-30T21:14:08.000Z,"Excited to see customers embrace the new frontier of data with #AWS. Customer @capellaspace is going all-in, launching the world’s largest commercial Synthetic Aperture Radar (SAR) satellite system to collect data during all-weather conditions, day &amp; night https://t.co/G6VhL4uBVV",2020,6,30
200,3,1277723621369077761,2020-06-29T22:00:24.000Z,"GA of Amazon CodeGuru, a #developer tool powered by #machinelearning where #AWS customers get intelligent recommendations for improving code quality &amp; identifying an app’s most expensive lines of code https://t.co/ORt8AnsuQj",2020,6,29
201,4,1277638045076877322,2020-06-29T16:20:21.000Z,"Excited to see the big, diversified data company — @IHSMarkit — moving from on-premises datacenters to the #Cloud and #AWS https://t.co/YXnRCv0nY8",2020,6,29
202,5,1276269365676007424,2020-06-25T21:41:43.000Z,Pretty cool... https://t.co/3cGTivFEIh,2020,6,25
203,6,1275934257051918336,2020-06-24T23:30:07.000Z,"How many apps never get built b/c people don't have programming skills or the technology team is too busy to get your app? A lot. This is what our new #AWS service, Amazon Honeycode, intends to address. Makes everybody a #builder. https://t.co/1XBCGofg5F",2020,6,24
204,0,1274440909292056576,2020-06-20T20:36:05.000Z,Agree with @Werner...interesting and thoughtful from @DonMacAskill on #ARM and #AWS#graviton2 (worth reading whole thread) https://t.co/M0ZMtZUIMU,2020,6,20
205,1,1273708602729959424,2020-06-18T20:06:09.000Z,"Another good decision, imo, by Supreme Court...https://t.co/cjmKNuB3mH",2020,6,18
206,2,1273318663882334209,2020-06-17T18:16:41.000Z,"Sometimes good things come in small packages. Introducing #AWS Snowcone, a new rugged, secure #edgecomputing &amp; #datatransfer device that@ under 5lbs fits in mailbox or backpack, enabling customers to collect data, process locally &amp; move to AWS https://t.co/Os1Hjtc0u9",2020,6,17
207,3,1272622543778639872,2020-06-15T20:10:33.000Z,I look at the Supreme Court decision today on making it illegal to discriminate against LGBTQ people in the workplace and think about how crazy it is in 2020 that this was even a question. Good for the Supreme Court for getting this right.,2020,6,15
208,4,1271264376394149888,2020-06-12T02:13:40.000Z,"Excited to bring customers the next gen of Amazon EC2 instances powered by #AWS-designed, Arm-based Graviton2 processors that deliver up to 40% better price/performance than comparable current x86 instances. Should be a game changer! https://t.co/UCmidWcTmP",2020,6,12
209,5,1266847181891203072,2020-05-30T21:41:19.000Z,"*What* will it take for us to refuse to accept these unjust killings of black people? How many people must die, how many generations must endure, how much eyewitness video is required? What else do we need? We need better than what we're getting from courts and political leaders.",2020,5,30
210,6,1265719353258856450,2020-05-27T18:59:44.000Z,"Music has been a unique unifier of people, movements, &amp; causes through the ages -- @Amazon is proud to help @GovInslee raise money &amp; support for those most impacted through this state-wide #COVID19 relief effort #AllInWA https://t.co/CSlqFU4v9u",2020,5,27
211,7,1265371127347437568,2020-05-26T19:56:00.000Z,"With #AWS #machinelearning &amp; #analytics, we’re bringing @Bundesliga_EN fans around the world closer to the action on the pitch with Match Facts, like probability per shot &amp; more #sports #innovation #AmazonSageMaker https://t.co/jm6K6sAgqy",2020,5,26
212,0,1263499921824468993,2020-05-21T16:00:30.000Z,"These 5 #renewableenergy projects in China, Australia, &amp; US bring Amazon’s renewable project count to 91, totaling over 2,900 MW of capacity, &amp; will deliver more than 7.6M MWh of energy annually. Critical step towards our 100% renewable goal #AWS https://t.co/wqkpoQCJYz",2020,5,21
213,1,1260795505015091201,2020-05-14T04:54:07.000Z,People have loved Amazon Macie as simple and thorough way to discover/protect their sensitive data but have asked to be less expensive to use at scale. How’s 80-90% less expensive? That’s what we delivered today after months of hard work + invention. #AWS https://t.co/zmJd84PxZ2,2020,5,14
214,2,1260378445554397184,2020-05-13T01:16:52.000Z,Excited to give customers our new Arm-based #AWS EC2 M6g instances that leverage our Graviton2 processors and deliver up to 40% better price-performance than the latest x86 instances. Big deal for customers. https://t.co/4csA3qmM8Q,2020,5,13
215,3,1259963743716298754,2020-05-11T21:49:00.000Z,"Have you ever tried to do an Intranet search like ""what time is IT Help Desk Open"" + ended up w random list of docs/links? Happens all the time at cos. Internal enterprise search is a mess...til now w launch of Amazon Kendra #AWS  https://t.co/R3gJmQyNCj",2020,5,11
216,4,1257807135968079872,2020-05-05T22:59:24.000Z,"Excited to give #AWS customers new warm storage for Amazon Elasticsearch...UltraWarm will let customers keep more log data, at 1/10th the cost of other warm storage options and with query perf up to 50% snappier that other warm storage solutions...https://t.co/z8klo0OFn4",2020,5,5
217,5,1255154312365264914,2020-04-28T15:18:02.000Z,"Proud to launch the #AWS Europe (Milan) Region and deepen our ongoing support/commitment to Italian customers —  secure, scalable, highly available computing power is critical to helping Italian communities stay connected during this difficult time https://t.co/hFKdiYyPDB",2020,4,28
218,0,1254194117552140288,2020-04-25T23:42:34.000Z,"Congrats to @NFL on 1st ever remote @NFLDraft, a pretty audacious feat if you ask me. Proud of role #AWS played in powering over 100 live feeds thru 7 rounds &amp; 3 days #AWSisHow #NFLDraft  https://t.co/nuSNQrzFQI",2020,4,25
219,1,1253751443841888256,2020-04-24T18:23:32.000Z,Excited to give Amazon Keyspaces (for Apache Cassandra) to #AWS customers so they can run Cassandra without having to worry about managing underlying infrastructure...game changer for Cassandra users  https://t.co/kjIswGDHmI,2020,4,24
220,2,1253406434017964032,2020-04-23T19:32:35.000Z,"AppFlow should be exciting for #AWS customers looking to securely use data across AWS and #SaaS providers like @Salesforce, @Slack, @Marketo, etc. Game changer in ease of doing... https://t.co/a0oC54yXCN",2020,4,23
221,3,1253004288541880320,2020-04-22T16:54:36.000Z,"Happy to have #AWS Africa (Cape Town) Region now open, providing access to scalable, dependable, low latency, &amp; highly secure computing power in Africa that is vital to keeping organizations moving forward right now. https://t.co/9jeqlC26v9",2020,4,22
222,4,1252719650825072642,2020-04-21T22:03:33.000Z,"RT @RainierScholars: Thank you, @amazon, for standing by us as a #RS20thAnniversarySponsor. 

Find more inspiring stories at: https://t.co/…",2020,4,21
223,5,1250932116767948801,2020-04-16T23:40:32.000Z,"Inspired by the innovation of #AWS customers &amp; partners – like @Nextdoor, @UCSDHealth, and so many more – who are delivering to support those on the front lines of #COVID19 &amp; helping the rest of us remain safe &amp; productive while staying home https://t.co/HlSlrDVJv2",2020,4,16
224,6,1250584986442330112,2020-04-16T00:41:10.000Z,"What's esp cool is a 19-year-old Providence resident came up with the idea in order to make it easy to donate phones/tablets/laptops to #RhodeIsland hospitals – @GovRaimondo listened/acted on idea, &amp; facilitated collaboration w/ the #medical community. Love the team innovation. https://t.co/AifnxCOgAS",2020,4,16
225,7,1249843451086045185,2020-04-13T23:34:34.000Z,Encouraging to see progress... https://t.co/KNKKKmun39,2020,4,13
226,8,1248060803498029056,2020-04-09T01:30:58.000Z,"Breakthroughs around #COVID19 will arrive faster when everyone can access &amp; experiment w/ #data on the pandemic. That's why today we made public the #AWS COVID-19 #datalake, a central repository for up-to-date &amp; curated datasets related to the virus. https://t.co/SAakcolup9",2020,4,9
227,9,1247156034264633345,2020-04-06T13:35:44.000Z,Proud @amazon is helping make sure @SeaPubSchools #students from underserved &amp; underrepresented communities have the ability to keep #learning during the #COVID19 pandemic. #Seattle #community https://t.co/liflyuwCTj,2020,4,6
228,10,1245482354451156994,2020-04-01T22:45:07.000Z,"Congrats to Isaiah Stewart in pursuing his NBA dream. Have gotten a chance to know him this past year and I'm not sure I've met a more outstanding 18 year old (as a player and person). Wherever he goes is gonna love him...we'll miss him in Seattle
https://t.co/U1UP70L1ir",2020,4,1
229,11,1245349668654964737,2020-04-01T13:57:53.000Z,"Cool story...one of many ways companies in the Seattle community are trying to help in this crazy time...

https://t.co/MEfc6lUwsy",2020,4,1
230,0,1241599878595137536,2020-03-22T05:37:33.000Z,The very best who ever did it... https://t.co/qsL9wkugzb,2020,3,22
231,1,1241058628561326080,2020-03-20T17:46:49.000Z,"With the #AWS Diagnostic Development Initiative, we're helping customers bring better, more accurate #COVID19 #diagnostic solutions to market – faster detection enables faster treatment, containment, &amp; in time will help shorten the course of this epidemic. https://t.co/UcmHldFRYh",2020,3,20
232,0,1234121039413534723,2020-03-01T14:19:19.000Z,Thought this was pretty amusing...Happy Caturday: https://t.co/l0jcXSCvYa  @AWScloud #AmazonSageMaker #AWSDeepLens #AWS,2020,3,1
233,1,1232841103868432384,2020-02-27T01:33:18.000Z,"This is the kind of big change and transformation that’s possible w/ the right leadership, senior-management conviction, and alignment from customers. Really cool to see, @fredlee @carsdotcom! #AWS #cloudcomputing https://t.co/ZzX6qqEAPL",2020,2,27
234,0,1228412052080930821,2020-02-14T20:13:50.000Z,"Really enjoyed speaking @NBA Tech Summit today – interesting conversations around #innovation and the future of #tech. Thank you, Commissioner Silver, for the invite! #NBAAllStar #AWS",2020,2,14
235,1,1225192103413796864,2020-02-05T22:58:55.000Z,Looking forward to partnering deeply with Carrier in their cloud transformation and current and future innovation... https://t.co/XM0sdoTqCl,2020,2,5
236,2,1222903400439791622,2020-01-30T15:24:25.000Z,"Really cool to see #AWS partners like VoiceFoundry, who are helping customers modernize their contact centers with #AmazonConnect (VoiceFoundry, which solely focuses on Amazon Connect implementation, is realizing 400-600% yoy growth): https://t.co/wo8mQ9oQfl",2020,1,30
237,0,1220131693820030976,2020-01-22T23:50:39.000Z,"Thank you, President Sanchez. Excited to continue supporting Spain’s #tech #innovation with @AWScloud #Davos2020 https://t.co/gTn6GxKuct",2020,1,22
238,1,1217635503987662848,2020-01-16T02:31:41.000Z,Germany’s premier football league @Bundesliga_EN is going all-in on #AWS. Love the recent acceleration in cloud adoption in #sports + seeing #AWS #machinelearning #analytics deliver in-depth insights &amp; enable new personalized fan experiences https://t.co/RKz2lQo3FP,2020,1,16
239,2,1214775839050612736,2020-01-08T05:08:24.000Z,RIP to perhaps my favorite college professor...SRO for his lectures and I felt lucky to be in his class... https://t.co/fKFTNCe4uq,2020,1,8
240,0,1210375945065861126,2019-12-27T01:44:47.000Z,"I love the movie October Sky. So well made, but also a reminder that when folks say your ideas are nonsense, waste of time, unsafe, never going to amount to anything, double down if you have conviction. Think of how many of the world's most important inventions started this way.",2019,12,27
241,1,1205303464823275520,2019-12-13T01:48:34.000Z,Two thank you's – to #Seattle’s own Franklin High School for having me &amp; to the 100+ of my fellow #Amazon volunteers who came out &amp; inspired kids to try #computerscience through @codeorg’s #HourOfCode today #AWS #AmazonFutureEngineer #AWSEducate https://t.co/IE6CAhNAfD,2019,12,13
242,0,1203711504798773248,2019-12-08T16:22:41.000Z,"I can't believe how good the first year of #IntersectFest was. Unbelievable music line-up  (last night, Foos, Anderson Paak, Zach Person, Shawn Mullins, Willy Porter all were awesome), amazing venue, really cool art and tech displays...really festive. Wish there was one more day!",2019,12,8
243,1,1203436851786240000,2019-12-07T22:11:18.000Z,"The first day of #IntersectFest was fantastic yesterday. Beck was incredible. So good. H.E.R. also crushed it. Lineup today is *so* good. Can't wait for Willy, Shawn, Zach, Brandi, Anderson Paak, and Foos!",2019,12,7
244,2,1203398881058275328,2019-12-07T19:40:25.000Z,"Just wanted to thank everybody for being with us this week at #awsreinvent...it's our favorite week of the year, inspiring for all of us on the #AWS team to be with so many of our customers, a great learning week for us, and energizing. Hope you enjoyed, too.",2019,12,7
245,3,1202700031259602944,2019-12-05T21:23:27.000Z,Really excited about our #AWS partnership with the #NFL and the ability to transform player health and safety outcomes for the game. https://t.co/Eol7xACPMr,2019,12,5
246,4,1202635207301464064,2019-12-05T17:05:51.000Z,"Congrats to SOLA, our 2019 #AWS DeepRacer champion. First female champion and multiple world records! On to 2020 and head to head racing!! #awsreinvent https://t.co/wMIKAcfnCd",2019,12,5
247,5,1202419816302170112,2019-12-05T02:49:58.000Z,"Super-excited about our new security service called Amazon Detective, which analyzes trillions of data points to make it easier to conduct faster, more efficient investigations into potential security issues across their workloads https://t.co/kQchhkx8Hw #AWS #reInvent",2019,12,5
248,6,1201709729396875265,2019-12-03T03:48:20.000Z,Customers have been asking for ways to experiment w/ #quantumcomputing &amp; explore the technology’s potential – excited to give folks that capability with #AWS Braket https://t.co/eel9tb0dGl #reInvent,2019,12,3
249,7,1199207369080623104,2019-11-26T06:04:51.000Z,Some late night writing trying to finish this year's version of my #AWS #reInvent keynote...almost done. Almost exactly a week away...see you soon! https://t.co/DWgd2NHeOW,2019,11,26
250,8,1199009141190062080,2019-11-25T16:57:10.000Z,"Looking forward to helping the #Seattle @Seahawks drive deep analysis of #NFL game footage, inform game strategy, &amp; deliver actionable insights to positively impact decision-making with #AWS #cloud, #machinelearning, &amp; #artificialintelligence https://t.co/xK56BV3IPK",2019,11,25
251,9,1197669561081815040,2019-11-22T00:14:09.000Z,Few pre-#reinvent goodies-- several very useful enhancements to our #AWS #storage services: https://t.co/nQvdeistKK,2019,11,22
252,10,1197236121098309632,2019-11-20T19:31:49.000Z,. @WesternUnion just announced #AWS as its preferred long-term strategic cloud provider to build a more seamless &amp; reliable experience for its customers who send money &amp; #payments to over 200 countries and territories around the globe: https://t.co/BsmxMVYfA5,2019,11,20
253,11,1197164625541812226,2019-11-20T14:47:43.000Z,@WesternUnion just announced #AWS as its preferred long-term strategic cloud provider to build a more seamless &amp; reliable experience for its customers who send money &amp; #payments to over 200 countries and territories around the globe: https://t.co/BsmxMVYfA5,2019,11,20
254,12,1194792350322528256,2019-11-14T01:41:09.000Z,Excited about today’s announcement of #AWS Data Exchange – because doing #machinelearning &amp; #analytics at scale requires easy access to high quality data sets #AWS https://t.co/YRpEOG73Cl,2019,11,14
255,13,1194693963317334016,2019-11-13T19:10:11.000Z,"Working through our #AWS #reInvent keynotes, along with the other launches we have coming in Las Vegas, we've decided to announce some earlier. Some interesting ones coming the next couple weeks...and a few goodies at re:Invent as well. Look forward to seeing folks in few weeks,",2019,11,13
256,14,1194692430215335936,2019-11-13T19:04:06.000Z,@alsadowski like this suggestion a lot! hard to argue with Springsteen.,2019,11,13
257,0,1193924079553658880,2019-11-11T16:10:57.000Z,"As arguably the largest current employer of US Military Veterans in the world, we couldn't be more appreciative of the skills that Veterans bring to our mission, and we are incredibly thankful to Veterans all over the world for their service to our country.",2019,11,11
258,1,1193664408364302337,2019-11-10T22:59:06.000Z,Very exciting day for the Sounders in Seattle...cool to see the city come together as one (at least for a day)... https://t.co/sP1vnfh8ah,2019,11,10
259,2,1193322776767057920,2019-11-10T00:21:35.000Z,This was a great picture from a great moment in a great comeback last night.  pihttps://twitter.com/i/moments/1193236614681526274,2019,11,10
260,3,1191973845705613313,2019-11-06T07:01:25.000Z,"@sasan_goodarzi Up at 6a, work out on elliptical for an hour while reading docs I brought home from work the night before and watching Get Up on ESPN...the one quietish hour to myself all day.",2019,11,6
261,4,1184217914964172801,2019-10-15T21:22:07.000Z,"Big congratulations to all teams involved! And, some great resources in here for those curious how they did it...#AWS #database services https://t.co/3SPD8aD2Wa",2019,10,15
262,0,1183415877670060033,2019-10-13T16:15:06.000Z,"Pretty unusual and cool, imo...

https://t.co/CbngVmHkCC",2019,10,13
263,1,1183145653351800832,2019-10-12T22:21:20.000Z,"Happy to see the CA legislation on banning private prisons. It's nuts that the US has 5% of the world's population and 25% of the imprisoned population. And, the racial bias with which this incarceration is happening is awful. Hope they go after the three strikes law next.",2019,10,12
264,2,1181286797386477568,2019-10-07T19:14:54.000Z,"Excited about our newly launched service, #AWS AIQ, which lets customers quickly find, engage, &amp; get help from AWS-Certified 3P experts for on-demand project work. Changes game for newer AWS customers in access to experts and speed to deployment https://t.co/Mpn35kgMp6",2019,10,7
265,3,1179919729688891393,2019-10-04T00:42:40.000Z,Cool story on how @PFF @CollinsworthPFF are using #AWS to uncover never-before-seen metrics that will change the way that teams &amp; fans experience football #machinelearning: https://t.co/KEUSUGyXsp.,2019,10,4
266,4,1178690029289275397,2019-09-30T15:16:16.000Z,"Thought this short video was pretty cool...love what Convoy is doing to change freight and trucking in this country, and interesting to see how they're using #AWS SageMaker to change drivers' lives. https://t.co/oLr2wss7RK",2019,9,30
267,5,1175164690432806912,2019-09-20T21:47:50.000Z,"Customers like @EA &amp; @clarifai excited about the general availability of #AWS EC2 G4 instances to help accelerate computationally demanding tasks that benefit from additional GPU acceleration, like #machinelearning inference &amp; graphics-intensive workloads https://t.co/2VCRSMVZAO",2019,9,20
268,6,1174849718699954182,2019-09-20T00:56:15.000Z,Excited and committed to meet this challenge...important for our collective future. https://t.co/lVKUdko4oe,2019,9,20
269,0,1166074461033885696,2019-08-26T19:46:30.000Z,AWS developer communities are led by a passionate set of people whose silent work often goes unnoticed. That’s why I’m excited to see our current 5 #AWS Community Heroes in #India recognized for their evangelism &amp; customer obsession. https://t.co/pOeOmvyIHs,2019,8,26
270,0,1161638638901481474,2019-08-14T14:00:08.000Z,"Saddened to hear about long-time Amazonian and early AWS teammate Peter Cohen passing. There's no AWS without Peter, who wrote working backwards doc on S3 (then S4) and mturk (which he also ran). RIP Peter.",2019,8,14
271,1,1161356872621969408,2019-08-13T19:20:30.000Z,"RT @foofighters: VEGAS - GOOD TIMES AHEAD!! 🎲
@intersectfest Dec. 6 - 7
Tickets on sale this Friday, 8/16. 
https://t.co/lQ0JyJI4wZ

#Inter…",2019,8,13
272,0,1153777455989055489,2019-07-23T21:22:36.000Z,"Interesting CNBC video about how the #AWS #Snow family (Snowball, Snowball Edge, &amp; Snowmobile) is helping customers of all sizes move massive amounts of data – think exabytes – to #AWS via physical devices, and sometimes, even an 18-wheeler https://t.co/yvV8URrvMk",2019,7,23
273,1,1151491391731585024,2019-07-17T13:58:36.000Z,"Though FUD and drama sell, the facts are often a little different.. https://t.co/W8WH6q8KJp",2019,7,17
274,0,1147207514683056130,2019-07-05T18:16:00.000Z,Pretty cool... https://t.co/HjPXy3RPbN,2019,7,5
275,0,1139175224199585793,2019-06-13T14:18:32.000Z,Love this...we have to be helping kids develop the skills they need to participate in the economy that's taking shape...excited about how #AWS is continuing to partner with academic institutions on this...not close to being done! https://t.co/eeSHnsvC9c,2019,6,13
276,0,1134496174323486726,2019-05-31T16:25:40.000Z,@UnderscoreVC @Ivonnics @lilylyman Michael Skok-inspired!,2019,5,31
